review_id,date,content,author
UR123354426,2012-20-January,I had a chance to stay 1 night in Hotel Riverside Studios and I know it was my last visit at this hotel. The interior of the building is very old fashioned and I would recommend you to go through the dark corridors to your room only if you want to feel like in a horror movie. There are shared toilets as well as dirty bathrooms. Maybe it could be a good hotel for drunk people returning from the pub who don't care about where they will sleep in next 5 hours. On the other side the courtyard view rooms are quiet.,Petr U
UR122373124,2012-1-January,we arrived in NY expecting alot we got alot! the showers had hair i them we had food under the bed and the long dirty hallways felt like we were walking in a horror movie. we never saw any staff other than the grumpy receptionist. ... interesting yes,samgillett7
UR120251727,2011-6-November,It's certainly not worth the $128 I paid for it. Only thing I will give it is that I have worked at summer camps and lived in a tent for a summer which was better but the sheets were clean. The police officer story: we went to the vending machine for a snack and when we came back 3 officers asked if we lived there? We said no and they said well there has been complaints by residents who said its being used as a hotel. We said we were staying the night and they told us that it is not allowed to be used as a hotel and who did we get the room from. I said travelocity and they said well try and get your money back. SERIOUSLY if they are right and why would they be there if not then believe me when I say its NOT a hotel! MY FIANCEE WAS SCARED THE WHOLE NIGHT - couldn't afford anywhere else at short notice...,gmansa80
UR118950863,2011-5-October,well where do i start the room was booked by my friends who flew in from overseas we arrive on 10/1/2011 love the vicinity it is located in but the lobby looks like a crack house that i have seen on tv the elevator was so small that 2 adults with large handbags would not fit comfortaby the rooms smelled strong of old ciggarettes and pee the bed sheets were marked and the heater was painted in an ugly pink the tv did not work the view outside was so crappy this bldg should be shut down its horrible we complained to the BBB cause these living conditions for anyone is not healthy they did not take a cancellation fee cause they told us we will not find a hotel room on the upper west side this close to the city for 700$ but we did at the hampton inn on 6th avenue.i advise anyone do not stay there (riveraide hotel),Natasha Wishuwe... S
UR91837460,2011-5-January,This was the most disquesting place that i have ever been to in my life. Everything is filthy the rooms are very small the sink in the room looked like it was going to fall off the wall. the TV was von top of a nasty little refridgerator and the remote had no back to hold the batteries in. It looks like no one ever cleansin the place and it is very smelly!!! The sorry excuse for a hotel seems more like tiny apartments turned into rooms with no bathrooms. PLEASE....P L E A S E ...... PLLEEEEEEEEASSSSSE NEVER GO to this sick nasty place!!!!! YOU WILL BE WASTING YOUR MONEY,malijax
UR118945773,2011-4-October,Attendant totally lazy and provided false info in order not to move or do anything. Rooms have moss which is unhealthy. only good thing about it is location. noisy outside due to construction but they promised a quiet room.,worldtraveler2392123
UR102255407,2011-31-March,My trip was for business and my girlfriend who traveled with me booked a room at this hotel without really looking into it. What a MISTAKE. When she made me aware that we didn't have our own bathroom in the room but would be using a "shared bathroom" I should have known this would be a disaster. But looking on the bright side of how cheap it was in a good location in NYC I decided we could grin and bear it. But I have never in my life experienced such a horrible stay in a hotel. The place smelled so bad upon walking into the lobby. The guy at the desk could barely check us in because him and some bums that were hanging out there with him were hitting on us the entire time. Then we go through a series of hallways that look like they were from a horror film to get to the elevator which looked like a door to a closet. Once inside the elevator you can barely breathe it smelled so bad and you had to hold your breath. There are people that live here apparently because the place used to be an apartment building so some peiople still live here for around $50 a week. These people could be mistaken for homeless people though which was sad. But they had signs that made no sense taped to their doors also flags and signs with obscene gestures and profane language on them!!! The room was awful. Decor didnt match was broken and stained and looked like it came from salvation army. I SWORE the bed was wooden when I sat on it it was so hard. There were dead bugs behind all the furniture. Outlets hanging out of walls. Only a sink in the room..so then we went to check out the shared bathroom. Pubic hair everywhere. Feces on floor on toilet on walls and near toilet paper holder. A sign was on the door saying "If you don't like the dirty bathroom CLEAN IT YOURSELF"!!!!! My friend and I were so upset that we tried checking out but would not only loose our money but everywhere else nearby was too expensive since most halfway decent places didn't have rooms. So we decided to deal with it. Woke up in the morning with the worst back pain in my life thanks to the bed. I had bites on me that I assume were from bed bugs. Squatted when using toilet and showered in flip flops. The water kept going from ice cold to burning hot when showering. The people who stayed there kept banging on the bathroom door when you take a shower. The heat in the room didn't work. I cant believe we made it out alive. SPARE YOURSELF THIS NIGHTMARE and DONT STAY HERE!!!!,janine0802
UR94607833,2011-27-January,This hotel is more like an old student dormitory with shared restroom/bathroom. The hotel condition is bad. The location is the only good thing. The staff was very rude when we asked if there is hot water available.,samh57
UR119682596,2011-24-October,Well if you are a rude traveler this hotel could seems an acceptable place to you. If you are such a person that only books 4 or upper stars hotels this one could means a terrible experience to you. Points in favor: It's near from everywhere in Manhattan island It's the cheapest hotel in the island You have shared bathroom maybe as accident you can know such a beauty girl with few clothes. Points against: It smells from the main door to anywhere inside. It's not a vomit smells but means that it has not a good cleaning and ventilation. As Argentinean I could say that it's extremely expensive. In Argentina with 100 bucks you can book a real good hotel maybe 5 stars. But considering that it's in Manhattan maybe riverside studios worth it. Shared bathroom there's not to much to say about this. If you don't use shared bathrooms this will be a terrible experience. In my own advice If you are such guys that go to new york and dinner in MacDonald's this is your best option. If you go to new york to live the top stars glamor just discard this webpage. Bye!!!,matias q
UR97745055,2011-23-February,Hands down the worst hotel I have ever stayed in...I should have know from the beginning as there is no parking for this hotel on a dead end street. As we entered the lobby and found our way to the elevator and eventually to our floor...as the door to the elevator opened to our floor it was written in black sharpie " 3rd Floor" as well as other graffiti.... As we entered the room (1) large burn mark from an Iron on the floor (2) blood smears on the wall as well as a host of dirty hand prints (3) dried boogers on the wall (4) You share a community bathroom which had urine all over the floor and smelled.....I immediately asked for another room and was given one next door... I opened the door to see toenail clippings on the floor...hand prints and boogers on the walls and a broken heater that could not be turned off..I called the front desk but was told to open the window which already had masken tape on it & I was to open the window in Feb...I had to go to the front desk passing numerous roaches to get pliers and a crank to turn my own heat off as a paying customer...This Place was a FLOP house......We went to cleaner hotel in Jersey.....,Dwilliams79
UR114628034,2011-22-June,I have never seen such a difference between a internet photo /review and the actual hotel.I am from the travel Industry and have travelled for 20 years to over 44 countries. Fortunately i only needed to selep and was busy the 2 days i was there. Rude staff.Totally lonley hotel. Even water vending machine was not working. The design of this building maybe First world war time!! and if you have luggage the multitude of doors and floors will tire you. The carpet was definately during Teddy Roosevelts time. South Asians ( i am one) who run motels in western countries must learn from Asia the art of service with a smile.It costs nothing. I have seen worse in India but for $ 240 for 2 nights even if it is NYC they can do much better!,wanderlust2hkv
UR118426774,2011-21-September,The first words out of the clerk's mouth were "the room doesn't have a bathroom". I believe that he says that if you look like you have any kind of class. Since the room is non-refundable they make money either way. We'd just come in from LA and didn't want to go looking for a room at night. So we get the key (when did you last see an actual hotel room key) and go up to our room (in the dingy elevator) with the intent of just staying the night. The hallways are really narrow and confusing. After finding the right hallway we went through a fire door. We were hit with an overpowering stench of urine. Holding our breaths the rest of the way we got to our door. Wait what's that on the door of the room next to us? It's a notice from the police not to enter the room. Must have been a murder committed there. We unlock the door and look upon a tiny room with a full side bed. It had a tv from the 60s might have been black and white. Sheets are stained window blind broken carpet dirty paint peeling and it smells. Didn't see any roaches or bedbugs but they were probably hiding. That was enough we fled the premises reported it to the BBB where they have an F rating (is that a surprise?). I took pictures before we left as we didn't think anyone would believe a hotel on the Westside could be this bad. Check them out and above all do not book a room there. I wouldn't board our dog there. We got a room at "On the Avenue" nearby. $10 less a night and a world of difference,Moe W
UR114566659,2011-20-June,I would advise not to go to this place. While it is relatively cheap and has a good location it is dirty to go to your room you have to go a long way with long solitary corridors and sometime you would see people just walking around that makes you wonder if they are also guests of the hotel or what...I am a female and went alone and did not feel safe at all. In addition the receptionists are not friendly. Also I still have bites from the bugs in the bed. I would consider spending a little bit more or going to a less expensive neighborhood.,mara039
UR118286345,2011-18-September,I been traveling all over the world from rich to poor and very poor countries and to be honest this was the worst ever. As soon as we get off from the taxi we saw the building and seems scary but you know could be just an old building but it wasn't just that. We went in to the reception and the guy didn't even say hi he just ask for the reservation. He gave us the key and the adventure starts. Is like 3 or 4 building all connected by a long and dirty corridor with 5 public phones cabin without the phone and all the cables out very dangeouros. Got into the elevator naaaaaaaaaaaaaasty smell awful we got off the elevator we took the left door ("S") and found our room but right in front of it was the toilet very small but that wouldn't be any problem it was unacceptable the shower full of hair reeeeaally dirty. I can keep writing more thing but honestly screw up my vacation. I have pictures about all this to proof it.,fefeq
UR108678372,2011-17-May,I booked this hotel for a friend and myself to stay in for 3 days. I booked the trip through Travelocity and thought I had found a real "steal" in the hotel as it was described. The only steal was my money because we left 15 minutes after we got there and they have refused to refund the money. It is by far the most disgusting hotel I have ever set foot in. I actually lived in a homeless shelter for 4 months and that was cleaner.,qwaide
UR115465088,2011-17-July,Not good folks. Bathroom is outside your room cleaners dump your clothes in the floor and the room is not too clean. Ahh I got what I paid for!,PaulMc7
UR118213229,2011-16-September,The pictures are truly deceptive. The hotel staff was rude and inconsiderate. This is one of the dirtiest hotels I have seen in my life! I booked this place through hotels.com after a verbal confirmation that I would have a private bath! After seeing the hotel and the shared bath; we were out in 10 minutes. We waited on the road while I worked out the refund with the staff at hotels.com. The only positive side to the place is it's location. And by the way it is NOT a cheap stay! One may rather stay on the streets! Thankfully we got our money back...from hotel.com; the hotel manager refused to even listen to our woes!,Niti6
UR116761146,2011-15-August,Smelly dingy and utterly uncomfortable. I BEGGED my children to take a shower in the shared bathroom. Our AC broke which was pinned into the window with boards the beds were rock hard and right when it couldn't get any worse we saw two roaches. I couldn't wait to leave...and neither could my children. If you're in and out and on an EXTREME budget (without children) this might work but save your NYC experience for another hotel if you can.,Amanda J
UR113000542,2011-13-June,There are a few things you might want to consider/ask yourself if you're thinking of staying here. Are you comfortable walking through a maze of doors and hallways that smell worse than a frat house after a night of binge drinking? Are you ok with taking a potentially temperature challenged shower every morning? Are you prepared to be-friend bed bugs? They have a 'no refund policy' which should have been the first clue buyer beware. However at $100/night for a room in Manhattan it's easy (at first) to forgive a dark dingy room that smells like a combination of vomit and air freshener combined. I understand that hostel living means that you have to walk down the hall to a bathroom but I didn't expect to find filthy bathrooms with roaches and trash on the floor. While there are multiple bathrooms per floor be prepared to wait for a long while if the "good bathroom" is in use. Also make sure you're ok with taking either scalding hot shower or numbingly cold one as the shower handles in almost every shower I used is incredibly finicky. If you're still thinking that this hotel is a deal and that you're only going to be sleeping there for a few nights you should also know that I stayed there over 2 weeks ago and I still have over 20 bed bug bites that are miserably itchy. My advice to you if you're searching for a great deal do a little more research online and find a room rent option instead.,geminixyn
UR116682843,2011-13-August,I'm from Florida and have never been to ny. From the outside I was excited to stay there we walked in and I thought I was in a horror movie. It literally smelled like murder and hookers. The elevator was a joke and the hallways were disgusting and scary. 5 seconds of being in the room we saw 2 roaches. I've never seen anything like it. My friends and I were laughing histerically as we sat in the room looking for another hotel then left the key and walked out the front door. Don't bring children here. If you're looking for a new york experience you'll never forget check this place out. But don't stay!!!,Alexandrarob
UR96355264,2011-12-February,This is by far the worst hotel Ive ever stayed in and Ive stayed in a lot of low budget places before since I dont like to spend that much money on accomondation. From the outside the hotel or hostel looks nice but when you enter its very worn down . The rooms are filthy sheets are durty beds are uncomfortable and my mettras was full with BEDBUGS!! The second night I got bitten all over my body. I went down to the reception showed the strange guy (receptionist) my bitemarks. He said that they had a problem with bedbugs and that we could change to a different room. We change rooms but I had problems sleeping cause my body was itching like crazy. We wanted to leave the horrible place but couldnt get a refund cause the room was already prepaid. We ended up stayed in the hotel for 4 nights then chose a different hotel for our last 2 night in NYC. The crap hotel ruined our vacation. I suggest you choose a different hotel.,gl0betr0ttern
UR119164290,2011-10-October,I want to preface this review with a note that I am a student and very unfussy person. I stay in hostels a lot (shared rooms with bunks shared bathrooms) so am used to "roughing it" a fair bit. I really try to give fair reviews on Tripadvisor. Hotel Riverside Studios is the most disgusting place I have ever stayed. Someone described the lobby as resembling a "crack house" and I would agree with this. The hallways are mouldy carpets peeling wires hanging everywhere. The general state of cleanliness is well below par. The entire hotel is dusty dirty and smelly. The room my friend had booked was a double for two. The bedsheets were stained the carpets were dirty I saw a huge cockroach scuttle along the floor and couldn't even tell my friend because she'd rather sleep on the subway than stay in a room with creepy-crawlies. The shared bathrooms were VILE. What looked like oil stains all over the bath the toilet blocked I actually felt gross using the water to brush my teeth. The worst moment of all was coming home after a night out and seeing a huge RAT run along the entrance to the hotel. It sounds like I'm making this up but I in no way am. Now that my friend and I are away from the dump that is Hotel Riverside Studios we can laugh about it but it kind of ruined our trip. We wanted to spend no time in the place at all and after a day in NYC sometimes all you want is a nice shower and bed. DO NOT STAY HERE! The website tricks you with nice pictures but it's a lie. Once you book your booking is non-refundable so they have you trapped. Don't stay here! Sleep under a bridge I guarantee it would be better!,maeveobrien
UR60720069,2010-8-April,We decided to save our money for the experience of New York so were reasonably pleased to pay 550 each for flights from Heathrow and 5 nights accommodation. Wow- were we ripped off!!! The location is great- very close to Columbus Circle and Central Park. However the hotel was disgusting- we found two cockroaches and it always stank of smelly food! I really don't know how this hotel got the one and half stars that it has been awarded. Try avoid this hotel at all costs. We did not spend much time in our room as we were out and about all day but this is the kind of room you definitely don't want to go back to after a long day of sight-seeing. After a fantastic trip to the Big Apple our accommodation was by far our biggest low light!,LondonSunsearcher
UR52825878,2010-7-January,THE "BEST" is the situation in the middle of Manhantan and very near of metro stations supermarkets fashion street banks... and the staff friendly and accesible. THE WORST: too much things. Begs in the bedroom windows that seem theres no window (so very cold and very noisy inside) and no courtains so you wake up very early in the morning. Old bathrooms (with broken tiles near the basin) old corridors stairs and elevators (in fact one of them didnt work the day of my arrival so i had to change my room). THE PRICE: about 412$ for 5 days the first week of Dec. Cheap for NY but if you can find something better dont hesitate. CLUE: find out and book with anticipation this will be the best to find a good hotel.,Ulisestgo
UR73951388,2010-5-August,First thing is first it looks spacious in the photographs. However it's not as big as you think. The room I stayed in had the basics: a bed pillows blankets and sheets a closet with hangers television small refrigerator a lamp some drawers a chair and air conditioning/heater. You also get a sink with a medicine cabinet in your own room! However it doesn't come with a bathroom. Your bathroom situation in this hotel is communal. The bathrooms on my floor needed some work. Maybe a lot of work. The bathroom with a tub has a problem with privacy. The shower curtain for the shower/tub doesn't completely block yourself from the person across the building from you. If anything the windows are somehow strategically placed to show more of yourself to the adjacent building than you want. The toilets are a bit tricky to flush and you would have to push on the lever completely down if you want any work done. The floors get wet really fast from the leaking pipes of the sinks and toilets. Things I wish I brought: -a roll of toilet paper -hand and body soap -my own towels -flip flops for the bathroom -shower caddy -bathroom robe This particular living situation reminds me of a college dorm room because of how you have to share some common space with complete strangers. I only stayed for 3 nights and 3 days and this room definitely made me want to stay out on the town more than anything else. Good thing I only stayed a few days because I don't think I could handle more. This room is great because it forces you to stay away from it.,cecacat
UR77313243,2010-29-August,We knew what we were getting to when we booked this place. It was the only place throughout our travels where we had to stay somewhere without an ensuite bathroom. New york was just too expensive nowhere else was affordable. So i knew that I was getting nothing for my money. I was almost pleasantly surprised to see that the room was clean enough although I wore flip flops all the time as the floor was questionable. But as long as the bed was clean I didn't mind. The sink was also fairly clean. However the communal bathrooms/showers were pretty grim. I also wore my flip flops the whole time in there including in the shower and just basically tried not to touch the sides. I struggled to get the water to heat up as well which was an issue but it eventually got to a bearable temperature. The bed was uncomfortable and springy and service was nothing special. They checked us in and out and that was about it. The metro was fairly nearby but I wouldn't have liked to have had to walk around on my own at night in this area. Overall this was a bearable stay but I wouldn't stay again if I had the choice.,Michelle444
UR77216440,2010-28-August,they charged even i did not stay in the hoteli am a servicemember coming from irak i try to get a nice place to stay with my wifethe place is the dirties place i ever been nastier that irak i did not get refundi had to get some other placethe hallways just a person can fitthe place smell bad the front desk is nasty i wont recomend this place no even to my worse enemyif you want more info contact me at [---],servicememberIrak
UR76838396,2010-25-August,do not stay there!! Bathroom is gross  rooms are small .This place is a dump there is no security at all .This is the worse hotel i've ever stepped in.,eliah3
UR59275121,2010-22-March,Do NOT stay at this "hotel" EVER! Spend the extra money on a nicer hotel. It is worth it! I have never felt SO disgusted in my entire life. This can hardly be considered a hotel... more like a bad hostel. Don't let the location of this place fool you. It may be in a really nice neighborhood but it is DIRTY!!!!! We found two large bed bugs in one of the bed and now I have insanely itchy bites all over my body. STAY AWAY!!!,MNinNYC
UR80440184,2010-21-September,Old not very clean bathrooms . Would not stay there again.,mikinbin
UR71643698,2010-20-July,Old putride. No WI FI. Bed bug INFESTED! No not stay here!,motherteacheryoga
UR69475552,2010-2-July,The room is very small has bare white walls no pictures mirrors nothing. Carpet is dirty and worn. The bed is small and hard. The room has a small sink and small table that' it. You have to bring a roll of toilet paper into the bathroom with you. The shared bathoom is very small and has an open window with no screen in it. Outside the bathroom window is a mess. The halls in this "hotel" are nerrow have bare white dirty walls and dirty worn carpet.,Kathy36518
UR80220646,2010-19-September,Dear fellow travelers dont believe the name of this accomodation its not a hotel! The state of the rooms the bathrooms restrooms and the dirtiness just reminds me of one of my former student homes and thats not a positive memory! I dont expect the quality of the Hilton for that price in NYC but what I do expect when I book a hotel is clean rooms clean sanitary and I want to feel safe. Thats all not available at Hotel Riverside Studios. The only good thing is the location.,cornie53
UR71521595,2010-19-July,Bed bugs!! Bed bugs!! Bed bugs!! Bed bugs!! Bed bugs!! Bed bugs!! Bed bugs!! Bed Bugs!! Bed bugs!! Bed bugs!!,jkatcher
