review_id,date,content,author
UR16839532,2008-11-June,Unfortunately this was a business trip where the client booked this hotel for us and we had no choice of leaving. There were inches on dust and grime on the large fake "chandeliers" and plastic flowers centered in the lobby area grime all over the floor dirt smears and broken glass in the lobby mirrors homeless people somewhat loitering in the indoor payphone area (hidden from the front desk by a partition but still part of the hotel lobby. near a long scary looking hallway with another door to the street. front desk made me use a payphone instead of agreeing to call my husband on the front desk phone to make sure I was a legitimate guest as we arrived on separate flights). The elevator was extremely dirty and rickety; hallways were dark darkly carpeted dirty. Room and bathroom you can imagine. They were no better. Stuffy stale itchy/stained bedding rust and dirt stained ceiling tiles and bathroom appliances and fixtures etc etc. "Window" of an airshaft looking at a brick wall less than 12 inches away and a lot of pigeons pigeon excrement feathers and debris built up in between. Plus I believe they wanted an extra $15 per day to access the in-room internet. A very bad stay unfriendly staff unsettling atmosphere. We used to live in New York City for many years and this is definitely not the way to experience the city. Nor is it ay cheaper than much better cleaner hotels. As to the payphone experience I also have to say the phones were disgustingly filmy slimy and grimy. My cell phone was dead and I was exhausted after a long flight alone from the west coast. I had to pay for the phone call to my husband's room upstairs on my credit card as I had no change on me just bills. Which the front desk also would not change for me after refusing to call the room. I have never been treated so rudely at a hotel before and never been denied having them call up to a room to ask a guest if I can enter. That was just the icing on the cake compared to the state of the hotel itself.,KristinCarlson
UR18850088,2008-11-August,This hotel is a dump. Talk about a bait and switch. The rooms look nothing like the pictures on their website. Our first room was filthy and smelled god awful. We complained and were given another room on the 5 th floor. This room was better but still left a whole lot to be desired. The entire floor smelled like feces. The hallways are dark dingy and have plaster falling off the walls. Our friends stayed on the 10 th floor and experienced the same. Also they fail to tell you that if you book with a debit card they charge an extra $75 a day for any damage. They claim they will refund it but that remains to be seen. Do yourself a favor and find somewhere else to stay.,fpd818
UR19949269,2008-10-September,The location of this hotel was excellent easy walking to a lot of sights and right across from Penn Station to go anywhere else. The room wasnt particularly clean a couple of things on the carpet nexver moved in the 4 nights we were there the shower dripped the whole time we were there I mentionned it twice but it wasnt fixed the noise kept us awake at night as did the exceptional noise from the street(we were on 10th floor)it needs double glazing. There was hardly storage space for our belongings and the room was very small for 2 people.The worst thing was when they charged us 4 dollars per case to leave our luggage for 2 hours beware!,harrassedmum
UR12497085,2008-10-January,This hotel is definitely the worst I have ever stayed in. Besides the fact that the place is dirty dingy and looks like more like a prison than a hotel the staff are downright rude and and even dishonest. I left some clothes behind me in my room when I checked out (accidently I should say) and when I returned from my friends house to retrieve them the staff lied to me saying that the guest who stayed there after me must have taken them even though this was the very next day!! I never write reviews online but I was so upset after this awful "holiday" that I feel I have to warn other people about this place. It has put me off New York for good.,KateDublin_8
UR22614119,2008-10-December,I have never stayed in a youth hostle but am sure that they must be on a similar vain to this hotel. I left the booking of the said hotel to friends ! who were advised positively by a travel agent. I knew on arrival that trouble lay ahead. I have only ever stayed in 4 stars and above but my companions were on a budget and I thought that a 2star establishment could not be that bad I was wrong !!. The staff were friendly on reception and were the hotels only redeeming feature. The queue was reminisent to that of an overused airport and check in was slow due to an undermaned desk. The common areas of the hotel were shaby and dingy and the rooms reflected what I would imagine to be a cheap brothel ( I only said imagine !! ) Dark carpets flakeing paint holes patched with a sheet of plaster board  and the bathrooms do not look like they have had an upgrade since the 1930s. The heating dates back to the arc and the non existent double glazing meant that you could hear the sound of the city ( and it is noisy ) 24 hours a day.I considered throwing myself from our room on the 16th floor but decided that New York had alot more to offer ( it did ) . The window safety cables incidently were all broken so it was possible to open them fully. Those wishing to take youngsters becareful. My advise. Stay well away and do not believe any positive reviews . The owners should be ashamed .,Edward999
UR19624693,2008-1-September,My son and I came to NYC to see the Yanks and wanted a place near Penn Station for 1 night We had stayed at the Affinia just two blocks away earlier in the Spring and wanted to go back there but they were sold out so we booked Hotel Pennsylvania. I will never go back. In the 1st room we were given the bathroom light kept flickering. They said they could fix it. I said we wanted another room. They switched us to a smaller room but at least the bathroom light worked. When my son pulled down the covers he found a piece of plastic and a hair on the sheets. At that late hour we didn't want to switch again (and what would we get) so we made the best of it. It was just one night. But in the room there was: no Bible no pad of paper no pen no washcloths and no way we'll ever be there again. The only positive was that the 19th floor gym was okay - carpet reminded me of what my grandmother had 40 years ago but a good selection of equipment. The final kicker - they charged to hold my bags for the day. The Affinia had done it for free. That will be my first choice next time.,TimetoRead
UR20524403,2008-1-October,My sister and I stayed here while in NY on a shopping trip. It was booked before we read the reviews obviously ! We were both very nervous having read the reviews and were expecting the worst but believe it or not there was worse to come. After 30 minutes waiting to check in with the receptionist who thought we were from Iran or Iraq instead of Ireland although we're both blonde ! She thought it was great that our husbands let us go away on our own ! After check in we went up in the lift to our room and Oh My God ! It was absolutely disgusting. First of all I got two electric shocks from the light switch in the bathroom !!!! The room was filthy dirty. The walls were crumbling the carpet was filthy and the first thing we did was check the beds for animals I called reception and told the receptionist about the electric shocks and that we wanted to be moved immediately. She sent up a lovely lady who goes around the hotel writing out incident reports (enough said). She took down the details of the electric shock and said she would have a porter come up to move us to a new room. After another 30 minutes a knock came to the door. I opened the door and a male porter arrived in and his words which I quote " So whats the problem ladies bedbugs cockroaches or mice" !!!!!!!!! My sister went into shock I think. I asked him if bedbugs etc were common in the hotel and he said they don't have a problem with mice rats as they have exterminators in every month. However the bedbugs can be a problem !! He brought us to a new room which to be honest wasn't much better a little cleaner maybe. This room was tiny but we had paid for the hotel and they were not willing to give refunds. The porter checked the beds for bedbugs without us asking him to do it. Apparently when you book into this hotel you are obliged not to complain. This disclaimer was signed at the travel agent where the trip was booked but I was not aware of this at the time. We stayed at the hotel for four nights and I have to say it completely ruined our break. This hotel is like a dungeon and I cannot stress enough how dirty disgusting and smelly it is. My advice would be to never ever ever stay here. The Affinia next door is a lovely hotel and not much more expensive. I have attached photographs in the event anyone thinks I'm overreacting. I've travelled quite a lot in Asia the US and Europe over the past ten years and I can honestly say that this is without a shadow of a doubt the worst hotel I have ever had to misfortune to stay in. BTW this is the first hotel review I have ever submitted. BE WARNED !!!!!!!!!!!!!!!!,eabhagrace
UR15554788,2008-1-May,I stayed in the hotel the night of April 28th because I was attending a conference at the hotel on the 29th. It was a mistake. The staff was very very nice but there were just too many problems. I stayed in room 1224A. First my room key would not work. Security had to let me into my room. The staff tried twice to get the computer to make a key that worked but to no avail. It finally got so late that I told them to forget it; I wasn't going out and I would just stay in my room until check out. The next problem was that the 7 AM wake up call I requested did not materialize. Since I woke up on time anyway it didn't matter but obviously it could have been a problem. Finally there was no shower head just a piece of pipe sticking out of the wall. It looked like there used to be a shower head at some point. It made it hard to get a shower. This was no huge problem but together with the lack of a functional key and the lack of a wake up call it added up to a less than optimal experience. I saw no other business travelers in the hotel. I imagine the hotel is in European guidebooks as an inexpensive place to stay in NYC which it was. I saw plenty of young Europeans. I saw no other Americans as guests. Of course this is not a problem at all; as a matter of fact it was fun to be around the guests from other countries. It just was not what I was looking for as a business traveler. Still it was clean enough. The staff was not very good at doing their jobs but they were definitely very nice.,CarolAnnBrynMawr
UR18503879,2008-1-August,After arriving form Dublin and enduring a long delay at airport to see a long queue at reception desk in hotel was almost the last straw. No that was left to the unsmiling desk staff  has anyone ever heard of customer service in this hotel . No fridge in room and when I requested one I was told that would be fine provided I paid 20 dollars  another near arguement and they relented I got my fridge which was really great as the air conditionong was like behaving like an orchestra. Do not buy a ticket from the tourist desk within this hotel  we were charged 145 dollars for a 72 dollar seat for Mama Mia show on Broadway. The cleaning staff are lovely and do a good job on the rooms.,GeorgioDublin
UR10061297,2007-9-October,I've stayed at the Pennsylvania a few times out of desperation. The rooms were filthy and the decor theme of the bathroom seemed to be "Mold-Mid Century". The beds leaved much to be desired. The only plus I could take out of this (other than not having to have a tetanus booster) was that the front desk was efficient and slightly friendly (I checked in very late probably avoiding the rush) and the location is convenient to all mass transportation. I've learned my lesson though and now go a few blocks up to the Hilton Gerden on 8th. Worth the walk!,MetroNYCTraveler
UR10713284,2007-9-November,....this hotel is the singularly most disgusting place I have stayed in. I have only lived in stayed in one place worse and that was a bad hostel. My friend warned me that someone private messaged her to say we shouldn't stay at this hotel we had fallen for the hotel's bright and shiny website and the fact they claimed they had renovated rooms. A lot of the pictures show on this website depict the experience. but what they don't show is the stench. When we arrived we were given a room that had blood and hair in one bed (I kid you not). There was thick dust everywhere (everything was gray because of it) We were shattered but we were forced to go down to reception. We were then given another room this room was better but had not been cleaned. I thought they had given us someone else's room by mistake. because there was rubbish everywhere beds looked like they had just been slept in. So back down we went. Finally they gave us a room which was better but still has my room crawling. I remember the stench and the terrible old bathroom. On my last day there I met a guy from another state who recounted almost exactly the same story to us but he was smarter and had demanded his money back for the bad service. I would not recommend this place to anyone...I have stayed in hostels and hotels alike of varying levels and this is truly awful.,Summersunt
UR7573043,2007-9-May,It's a crack hotel. Everything is filthy. Urine smell in the halls dirty windows dark creepy hallways strange forgotten connecting rooms broken doors missing doorknobs peeling paint broken tiles filthy bedspreads filthy rugs filthy blankets no service stained mattresses dead bugs had to switch rooms three times and still uninhabitable brought me to tears. I only stayed here for one night on business because everything else was sold out and was fooled by the nice looking lobby.,VirginiaTraveler5
UR6966453,2007-9-March,If you've heard the stories and figured they were exaggerations don't fool yourself. Do not stay at this hotel if you desire anything in terms of quality and service. We have been going to NYC for the Westminster Kennel Club Dog Show for quite a while now. The Penn is the host hotel for this show and it is convenient but up until this year we had never stayed there because of all the stories that we had heard. Unfortunatly due to extenuating circumstances we had to make our reservation at the Penn because we made our reservations late and the hotel that we usually booked was full. We figured "it can't be that bad" and "it's so close to the Garden." I don't care if they move the center court line at MSG to the lobby of the Penn we will not be staying there again. When we arrived we had to wait FOREVER for a bellman to assist us with our bags and they won't LET you do it yourself -- some kind of union thing. We got into our room and while it wasn't as bad as we had anticipated we were less than impressed. It was a TINY room. An exciting part was the VERY LARGE bathtub just perfect for a bubble bath - except when you collect the water in the tub it was a brownish green color - EWW. So all was going well until we came back from siteseeing our second day there - unable to get back into our room. Our key would not work. We went to the front desk for duplicate keys - they didn't work either. We waited in the hallway outside our room - mind you our show dogs were still locked inside our room - for 3 hours for someone to fix our door. After we finally were able to enter our door they told us that we would have to move rooms because they didn't know for sure what was wrong with our door and couldn't know for sure if it would happen again. So we loaded all of our stuff up on carts - we were there FOR the dog show and we had A LOT of stuff. And headed to the next room. This one was even tinier AND the wall outside the bathroom was literally disintegrating meanwhile dropping debris on the carpet. When we told the bellman that this room was unacceptable he said that his shift was over and he had to go home so he left our things in the hallway and we waited for a different room and a new bellman. Two more substantard rooms were offered before we arrived at one that would work. It was actually a room upgrade for us and was quite spacious. Not good enough to make me ever want to go back. The next few days went by without anything remarkable to note. Then came time to check out. A storm was coming and we wanted to leave in time to make it home (ohio) before we would be affected. So we got up early the day of check out and called down to the front desk to call for our car. They said when the car arrived we should call for a bellman. We waited almost an hour for the car and when we called for the bellman he said there would be an hour wait. It eneded up that we did get stuck in the snow and hour away from home and if they hadn't made us wait twice - we likely would have made it home safely the same day. The bad things you hear about this hotel are true. I've heard other stories but never any of them any good. Don't waste your money. If this is the area of town you want to stay in shorten your trip by a day if money is an issue and stay in the Affinia Manhattan where they do care about how they treat you and what you think of their accomodations. I will never stay in the Penn again.,ChosenOne413
UR7817922,2007-9-June,I have to preface this by saying that for the money you simply cannot beat the location. We walked to Times Square the Empire State buiding Central Park (though that was a bit of a hike) and pretty much everywhere else during our stay. There was food shopping and all kinds of entertainment right outside our door and Penn Station was right across the street making for the utmost of convience. That being said we booked two rooms for four nights. The king room had some strange sort of mold growing all over the shower that was completely disgusting. While they did offer to move us to another room the next room had similar growth in the bathroom. The gem of this room however was the view of the ESB! We decided to stay. The other room had two twin beds. There was obvious fading on the walls where the headboards had once been. The room showed signs of age and wear; little things that could have been kept up with but were not. The view from this room was straight into another room. Even straining as far as possible no glimpse of Manhattan could be seen. All in all though we were hardly ever in the room other than to sleep and the beds worked just fine for what we needed.,CarolinaGirl07
UR8075923,2007-8-July,We arrived late from Toronto having had flight problems and hold ups. Despite our room being booked months in advance they obviously don't allocate rooms to individuals so we were really surprise d to be given a room with dirty carpet dirty bathroom broken TV half the light bulbs were missing broken air conditioning etc. This was our most expensive hotel in a trip around north america - we would NEVER go back to New York again as this experience ruined our holiday. We asked to move rooms (in fact my wife and I were celebrating our 2nd wedding anniversary my wife was in tears) and they moved us to a room with a single bed - but at least the TV worked. We asked to move back to our original room as we really needed a double bed. Crashing into bed to sleep we were surprised that the fitted sheet didn't fit - our feet were on the matress. This hotel is HUGE and is hugely underinvested. They hadn't updated the decor in any of the 3 rooms we stayed in (they moved us on our second day to a barely 20th century room - I've stayed in better hotels in the 3rd world!) for 30+ years. They probably hadn't cleaned the rooms for a decade either. In short: do not stay at this hotel until they spend just a small amount of money on it. A complete and utter rip off.,harmsy
UR6564244,2007-8-January,We expected to find one cleanliness not exceptional but the rat in the room just not it was gone around calm between the suitcases and this is one seccante what truly. Naturally they have changed to us endured room and we have understood that all the plans are not equal some are more decent in how much restructures to you more than recent. Little sagacities type would be enough not to find the bath or the room with the rests of the previous hosts. However the hotel is in the central position a lot very connected with all.,mazzolini
UR11326781,2007-8-December,Room doors that look like coffin lids. Sea foam hotel sheets and towels bought from a prison supply store. Bedspread that maybe 10 years old. Somehow there was a flat screen TV in there but it randomly turned itself on and the weirdest hours. Anything over $100 a night is not worth it.,spanlaketraveler
UR8372450,2007-8-August,We recently had the misfortune of staying at this hotel. We queued for almost an hour to check in. When we finally got our room it was dirty wall paper was peeling off the walls; it smelled strongly of smoke despite it being a non-smoking room; and the cold water tap didn't work - the only redeeming features of the hotel were the location and the price....,EdinburghEuan
UR10631265,2007-6-November,Omg I'm suprised Health Inspectors dont shut this hotel down. our hotel had soo much mold under the heater there was a towel covering it up. Me and My girlfriend paid for a King Room... we got a twin bed..we complained ...we got our King But still... the room was nasty. we paid 400$ a night for 4 nights... we both got sick while sleeping in the room. And if ur hoping for a nyc view.... well u get a back alley view. the T.v is from the 70's the cable sucks hardly any reception. I do not recommend this Hotel to anyone. Only good thing about this hotel is its like 5 blocks away from Times Square and 50 feet from MSG. Never again I agree burn to the ground,JonFromPeg
UR6558978,2007-6-January,Well just got back from a 2 week stay at the penn hotel. Mixed feelings on the stay. Overall it was not a great experience. The room was a ok size with 2 double beds with torn bedsheets and linen. Bathroom was a bit small and quite dirty as well. Location is also ok but nothing great. (it depends on what you want to do ) In terms of the hotel i would say that if price is a issue its not tooo bad a place to stay however if you can find something along the same price probably take that option. Couple of reasons for the above comment  the caprpet in the room is filthy and is not vaccummed everyday (it was probably done once in the two weeks we stayed there ). In addition housekeeping has no idea what dusting means. Their idea of housekeeping is making the bed and replacing the towels and literally thats it dont expect anything more on a few days they did nto even bother to empty the rubbish bin in the room. While there i also kept my bags permanently locked and kept all valuables in my locked bags just go this feeling of uneasyness around the place. They do have safety deposit boxes but after you wait for half an hour to try and get a box and no one answer you really wonder if you want to leave valuables in a place like that. The other thing that is quite bad about the hotel is that you have to checkout by 12:00 pm (fair enough) but they charge you $4 storage fee for each bag that you want to leave in their luggage room after you have checked out. (most other hotesl will keep your bags for free) In terms of the staff they are about as usefull as a chocolate teapot. We had people in the room next door smoking on a non smoking floor and the smell kept coming in to our room When i complained I was told there is nothign we can do maybe housekeeping can spray somehting. (No staff member at that hotel seems to care about anything ) So overall if you are looking for a very basic roof over your head and basically a place to slepp this place if ok. If you plan on spending time relaxing in the room please book somehwere else even the bed sheets feel dirty. In conclusion this hotel is one that needs to be shut down all the staff ssacked and remaned in to a upper class hostel. Because that is what it is.,oac966
UR6748443,2007-5-February,This place is TERRIBLE the worst I have ever seen. Staff are rude and clueless. the first room they put me in was the wrong bed size it was filthly. The second room was even worse. Window would not close food on floor paint falling off the walls carpet looked nasty and door took some time and creativity to get locked. Never would I wish this place on anyone. The web site lies too and if you decide to risk it do not pre-pay by credit card or you will be sorry.,mkenmass2000
UR8619134,2007-4-September,I cried when i got to our room. We complained and were given an upgrade but it really put a damper on our trip. The room was dirty dingy smelled of damp and the bathroom-eughh!! I was impressed by the photos of the grand lobby thats why i booked- nice surprise for my boyfriend-NOT!! The upgraded room was bigger and cleaner but still in desperate need of a make over. The hotel owners need to spend their money on rooms not fancy marble(which was lovely in the lobby by the way!) I didnt spend a minute longer than we had to in the hotel and it was a real let down. The "candid photos" taken by other travellers in the hotel were exactly what we faced. Horrible. It was about 120 a night for 2 people and you can get a much nicer place elsewhere in New york so unless you are guarenteed a newly decorated room- do not go there!!,aberdeenlass1903
