review_id,date,content,author
UR102405510,2011-1-April,Room was next door to a ? plant room with loud noise of a compressor generator or air conditioning unit continuing all night. Not acceptable. To make it worse it was a room for people using wheelchairs - gave the impression of "sticking people with disabilities anywhere we can fit them in". Although I do not have a disability the impression given was not good on any basis.,PeterPan2
UR63664289,2010-9-May,Hotel is a 10 minute walk from Kings Cross (oddly there is another Travelodge closer to Kings Cross) and the big brown brick building looms round the corner as you approach it. On entering the reception was chaotic people everywhere and a few members of staff floating around. By the time I was served the receptionist was bored/tired/ready for a break and greeted me with all the warmth of a wet blanket. On getting my room key the trip to the room did nothing to change my initial impressions of the hotel the lifts are separated from main reception by a coded door this door is worn flaking and looks like a strong shove could knock it over. The lifts were a disgrace probably quite pleasant when new however had not seen a lick of polish for years. Out of the three lifts one was permanently broken one broke on the first night leaving one operational for a hotel of this size that was terrible. The room was clean and tidy but none of the cupboards closed properly the taps in the bathroom were hot or super hot (no cold!) the shower curtain looked like it held its own eco system and the windows were more reminiscent of a prison than a hotel. Night time was noisy through doors banking and guests shouting the next day things did not improve. Not a jewel in the Travelodge crown there are better hotels out there you'd be better of finding one of them.,Anton N
UR58105669,2010-9-March,Friendly staff at the check in desk but thats about it. When we got to our room we found it hadn't been cleaned my friend had a big curly hair in her bed and I had food in mine! opening the wardrobe we discovered someones suitcases and shopping bags it was only then we realised the hotelier had checked us into someone elses room. Clearly incompetent. Tea/Coffee facilities were available but no spoon to stir it with. Our room was warm enough but the other 4 girls said theirs were very cold and they didn't sleep. And now for the nitty gritty! The windows were filthy rooms poorly decorated there were 3 different colours on the walls which looked like they had just used up whatever they could find the hotel itself was just a maize and finding the reception via the stairs were very frustrating (The lift was always too full and took ages). There were sweet wrappers on the stairs which were still there when we left the next day large chunks of plaster missing off the walls on the stairs and mould on the window frames. My only advice would be if you are a student used to hostel bed downs for a night then this will be tolerable for you us bunch of girls are not snobby or posh but for 82 per room it could have been better particularly as the ibis just up the road in Euston is only 89-99 and marks at a 4* in comparison.,Stormyelf
UR70321391,2010-9-July,This is the hotel that air conditioning forgot. Stuffy rooms grimy bathrooms and as for a night's sleep? Forget it. I was booked in for conference nearby but at 60 quid a night do yourself a favour and go elsewhere.,Areyoubeingserved
UR66829323,2010-8-June,I have to say that I was extremely disappointed with the standards at this hotel during our recent stay. Two of the three lifts were out of order for the duration of our stay and the one lift that was in use was in very poor condition there were panels missing inside the lift some of the paint was scratched off and on one occasion there was saliva on the floor that made me feel really quite ill. On the occasions that the lift was too busy we used the stairs the walls on the stairs were disgusting they were dirty and in some places there was plaster falling off the walls. Once leaving the lift walking down the corridor to our room the walls were in a bad state they were also very dirty. Our room was just as bad in fact I would go so far as to describe it as filthy. The wall heater had black smears and finger marks all over it The walls were dirty and had marks and stains all over them there were also holes in the wall in places. The curtains were hanging off the rails There was a large crack in the frame of the television The mirror on the wall in the bedroom area was dirty and had something goodness only knows what dripping down it. The bathroom door on the inside had varnish missing and looked old and worn. The sink tap was very dirty and looked like it had not been cleaned for some time the same goes for the other fittings in the bathroom. The shower curtain rail was rusty. Around the tiled walls of the bath the grouting was covered in black mould/mildew not just small amounts but big black patches. The toilet was absolutely vile it was badly stained inside. There was a brown stain on the white duvet cover. There were only two pillows supplied. There was no "Do Not Disturb" sign in the room to use. So we were woken in the morning by the maid wanting to service the room. There was what looked like an old wall heater on the wall that had been disconnected; the vents on the heater were quite visibly full of thick dust. When the room was cleaned the towels were not re folded and were just left hanging on the back of a chair where we had left them that morning. On the whole the hotel felt disgustingly dirty and was in serious need of some cleaning and maintenance. I have never seen anything quite so bad in any other hotel that I have stayed in. The standards of cleanliness were atrocious. We booked using the Saver Rate despite that I still would have expected some kind of standards.,ustwo2008
UR89312979,2010-8-December,Pro - quiet room and a bath Con-few staff.no chair in room .no ironing board . 1 person on evening check in. Look for somewhere cheaper.,Filllua
UR74270710,2010-8-August,The hotel's location is perfect - near King's Cross station. This is its only redeeming quality. The hotel looks very run down both from inside and outside. It badly needs some paint to brighten it up. It is cheaper than other hotels in the surrounding area but you get exactly what you pay for. The air-con does not work in the rooms. The rooms are tiny. It has two lifts which take forever to go up and down. There are no phones or hairdryers in the rooms. You can 'borrow' a hairdryer for an hour at a time. There are computers to access the internet in the reception area. There are tea and coffee making facilities in the rooms. If you only want a base to sleep in in a good location and don't intend spending any time in the room this hotel is perfect. Otherwise I would avoid.,Donegalabu
UR86284411,2010-7-November,Well Travelodge Royal Scot is probably the worst hotel ive ever stayed in Room 507 a triple room was our given room. If privacy is what you want forget it because the skyline of London outside views the inside of your room due to none fitting curtains which are at 6inchs short in length and 6 inchs short in width. Also with damp on the walls broken drawers ripped lamp shades and the smallest bathroom known to man if you want to book here forget it and choose somewhere else.,Icky_10
UR66687132,2010-7-June,Comments: 1. There's no air in rooms (unless you bring some air from home). windows can't be opened (maybe because of safety) . the windows are actually blocked. There's aircondition in the room but it doesnt activated. It was told by management that "it is not activated because of MANAGEMENT POLICY REASONS". From 3 elevators in the hotel only one was actually active ( a rather small one). we stayed in that hotel 4 nights and it seems nobody even intends to fix these 2 broken elevators.so dont buy stories about "we r fixing now the elevators ASAP" it's B.S. each night several buses full with tourists are crowded into that narrow poor elevator and of course the phenomenon repeats itself also in the mornings. breakfast are fine but I advice you to give up the sunday breakfast unless you want to stand in line with other 250 poor guests waiting endlessly (we gave up). There's no clear signs to the stairs and when you go down you may find yourself in a closed yard under the building. in case of fire People will be killed over there! There's lack of towels and no phone in rooms. You need to be a genious to activate the taps in the bathroom. It took me about 3 days to find all the options of that heroic invention (cold/warm/strength of water). The stuff is divided. some it is apathetic but some are nice. Last word DO NOT...,Thats_10
UR78530201,2010-6-September,I am going to start this 'bad review' on a positive note. I had two weeks work experience in London and as my place of work was in Farringdon this was one of the closest travelodges. I booked two weeks at Kings Cross with a weekends gap in between. The first week I stayed I could not fault the place. I was allocated a room on the sixth floor. It was spacious and clean with an ample size bathroom and comfortable bed. Although overlooking the main road outside it was remarkably quiet. Overall a very pleasant stay. I returned the next week after a less than pleasant journey expecting the same high level of hospitality how wrong I was! On arrival I was told I had to pay an early check in fee of 10 because I arrived earlier than 3pm a little cheeky I thought but paid nevertheless. My room was on the second floor ( I say the second floor it was like wandering a maze but i eventually found the room. This time and as I opened the door I was greeted with a room that looked like it belonged in a completely different hotel. The room had a single bed (i booked a double) a desk with no chair (no suitable as I was using the desk in the hotel to do work in the evenings) I horrible smell of damp and general uncleanliness. Depsite being on my lunchbreak from my work experience i decided to tackle the problem earlier rather than later. I went back to reception where I queued for at least ten minutes before someone assisted me I handed the man the key and simply said i thought there had been a mistake as i booked a double and i'd been given a single. He snatched the key from me put something into his computer and insisted that 'all rooms where the same' I then told him about my previous stay and requested the same if not a similar room. He told me i must be making it up as all the rooms in this hotel are apparently the 'same'. I explained about the chair his solution was the following 'take a chair from reception up to your room if you need a chair so badly'. I then asked rather more sternly to change rooms to which I was told there were none clean unless I was willing to pay another 10 early check in charge! I refused and returned to the hotel after 3pm. My room was changed by a woman behind the desk. I was situated on the first floor. Granted in a double room (they got one thing right at last!) the room however had no window a tv that didnt work a tiny bathroom was noisy and generally smelt of an old peoples home. I am disgusted with the service i received over the second week of my stay. The staff were rude and unhelpful. This Travelodge is not worth nearly 90 a night. My recommendation is if you must stay here request a room on the 6th floor as these seem to be the VIP rooms (that apparently don't exist according to hotel staff!),GraduateDesigner
UR89157353,2010-6-December,Appalling - unsafe and unhygienic. There was a large crack in the sink mould all around the bath a broken bulb hanging from the bedside light. Got there too late to change hotels and the staff couldnt or wouldnt move me. The hot breakfast was cold and restaurant floor was sticky and the chairs filthy. Staff totally uninterested in helping or even recording my complaints. On top of all that they charged 200. Filled in the complaints form on the website and only got platitudes. You just know nothing was going to get done.,Godfrog
UR82222428,2010-5-October,I'll start by pointing out that I have stayed in many Travelodges. I like Travelodge because you know what you're getting: a clean basic room at a good price (and what you're not ie any frills). I am afraid that my stay in Travelodge Kings Cross Royal Scot has shaken my faith in the chain and I am definitely being more selective with where I stay now. First impressions of this hotel were not bad. All seemed fine on entering the large and modern-looking reception area and the receptionist greeted us with a smile (not always forthcoming in London). Things went downhill when we headed up to our room in the angriest sounding lift I've ever heard. I almost expected it to say "FOURTH FLOOR GET OUT". The fourth floor was even less welcoming with peeling paint and dirty carpets. So far so bad. Of course the worst thing about this hotel had to be our room. We had a family room with three tiny single beds crammed in. A light bulb out a cigarette end in the drawer graffiti on the desk and a broken panel under the sink which had just been left there rather than fixed (although it did seem a bit beyond fixing...). The inner window pane was jammed open letting in the freezing cold and plenty of noise from outside. We did inform reception about this and a workman dealt with it quickly. This and the friendly staff were the only redeeming features of this hotel. The location may be convenient but it's noisy our room was pretty horrible and we couldn't wait to get away. I actually felt somewhat unsafe staying in a hotel that is in such a state of disrepair. I can't think of any kind of traveller I'd recommend this hotel to especially considering that there doesn't seem to be any consistency in price (on some days it can be more expensive than other hotels in the area). Consider Travelodge Euston over this one.,WorldFuneral
UR69738103,2010-5-July,Avoid this hotel at all costs. If you want to stay in a London Travelodge use the Euston one which is new clean and in a much better (safer location). We had booked a triple room as there are no family rooms. The first room allocated was a single (at a stretch a double) with 3 beds squeezed in. We rejected this and were allocated a better room and the receptionist did this promptly and efficiently. The power has tripped in the room so another trip to reception to get maintenance who came and rectified it promptly. To echo other reviews the furniture is from the early eighties and falling apart paintwork tired and generally the hotel has not been maintained for years. We left our room about 6.30 and were back around 9. In that time someone had accessed our room left a coke can and messed around with a toy of my daughters. Luckily nothing missing. Reception manager didn't seem that concerned when I spoke to him about this and made no effort to apologise or want to get to the bottom of how our room was accessed illegally. Don't expect to sleep here noisy even if at the back of the hotel and seems to be frequented by large groups of teenage european school trips making noise in the corridors and slamming doors till midnight. The icing on the cake was getting reception to roder us a taxi to st pancras as we had lots of luggage. The "pre-booked" taxi cost almost double a black cab. If I had paid more than the 29 for this room i would be even more unhappy than I am.,ScottishFamilyGuy
UR54827898,2010-31-January,shabby tired no hot water no curtains and lights that worked when they felt like it! a disgrace to the travelodge logo. only there for two nights-came home more tired than i went. convenient for station but that is all you can say about it.,LincsBetsy
UR69269894,2010-30-June,Was booked into this hotel by a travel consolidator - Wimbledon week so prices were high (120 for a single room for the night). I'm not usually moved to post reviews but my experience was so bad that I thought I should share it. On arrival I had to queue for 25 minutes with heavy bags because the reception was grossly understaffed. Eventually I was checked in but it took a further ten minutes to get to my room because two of the three lifts were out of order. When I opened the room there was another family inside!! Clearly disconcerting from a privacy and safety perspective. So another trek down to reception and I eventually got a room from a disinterested unapologetic member of reception staff. Well more of an oven than a room - it was a hot day and the cooling unit in the room was out of order. Tried to borrow a fan but unsurprisingly they had none. The final straw was when I asked for an iron they could not provide this - asked me to return in 'a few hours' (after midnight) which I duly did - but still no iron and no suggestions as to how I could prepare my clothes for the morning. I was left lying awake in the sweltering heat listening to whatever my hard-of-hearing neighbour had on the television until about 3 in the morning. A complete dump. Stay in one of the budget hotels around King's Cross or Paddington instead.,notmad_nomad
UR81407443,2010-28-September,Travel lodge are really cheap for a good reason. This hotels decor is very tired. I appreciate you get what you pay for and if there is nowhere else I guess you have to take this. Just remember budget hotel so there is no shampoo no hairdryer no iron I stay in hotels because of work about 50+ times a year.... I rarely write reviews but feel the need to tell people what this place is like. Everything worked in my room TV toilet taps even though there were bits missing off the taps bathroom door vent was damaged room 405. Room and bathroom looked reasonably clean but just very tired. The single bed was not comfortable very narrow - child size the windows did open.... but even with the secondary glazing the noise of sirens passing every ten minutes you would want to keep windows closed... (not hotels fault sirens of course) but I closed my windows and could still hear sirens. Every door bangs - either the self closing mechanisms are broken or just not adjusted properly... I guess you could blame the other guests for allowing doors to bang. During my stay I must have been there with some of the most inconsiderate people araound... loud voices in corridors right through the night and children running up and down the corridor... again I suppose not hotels fault for guests behaviour. We had an evening meal in the hotel popadoms were supposed to come with the meal but we had to ask for them as they did not arrive. When popadoms arrived they were supposed to come with mango chutney - but they came with barbecue sauce - we pointe dthis out to be told they had no mango chutney. Did not think to explain that when meal was ordered or when popadoms were delivered. Just like they had no salad either but they did manage to mention that at the point of ordering.... At breakfast it's a buffett style food wasnt bad. There is no organisation about where people sit - so one person will take a table for four - seats are removed - and even though people have finished people still sit there talking even though people are stood waiting for tables... again I guess you could say not hotels fault.... but could they do something like a polite notice perhaps? There are really not many seats especially with the size of the hotel - I would recommend if you do stay forget breakfast at the hotel and grab something locally there are many pavement cafes within a few minutes walk.,LynneFL10
UR57328654,2010-28-February,If you get this room cheap - which in most cases isnt the case - I paid comparative price to the other London Travelodges which are mostly good then I suppose you might expect basic budget accommodation. However this doesnt account for the 'shabby chic' look of light fittings hanging off your wall - that cant be safe. Grubby carpets; grubby walls; beds that any prisoner would turn their nose up at and because the worn out secondary glazing couldnt be closed a night of 'sleep' that could be equalled to a night spent on a traffic island. I presume from the couple of positive reviews on this hotel that a small number of rooms have been upgraded - lucky you if you got one of these. In the majority they are disgusting. Travelodge say it is an acquisition property but its not a newly acquisitioned property so they should be dealing with this issue now. Close it down completely gut it and upgrade it to match the other London Travelodges and lets start again. If you can afford ' a few dollars more' stay away from here - you wont regret it!,Playitfair
UR81202837,2010-27-September,Stayed here for two nights recently Anyone who could find this hotel in any way acceptable must have a very low expectation of what a hotel should be like. From the moment we arrived it was obvious this was a very tired and poorly maintained hotel. The carpets were worn and with gum trodden in the lifts were tiny and even if they had all been working there wouldn't have been half enough. Our room although clean had a patch of wallpaper torn off funiture looked like it had been installed in the seventies and in the bathroom there was no plug for the sink and the shower curtain was so long it was almost impossible not to stand on it making showering decidedly hard. The single beds although quite comfortable were only two foot six wide you turn over very carefully. Breakfast would be best described as a bunfight. Too many people not enough seats although the food as actually quite good. If you're under thirty and need somewhere cheap and you're not fussy stay here!. I cetainly won't be back.,Bruceandann
UR88306493,2010-26-November,Access: 15 mins walk from Kings Cross tube Check In: Pretty quick Room: 4th Floor room. Checked my mattress and carpet for bed bugs but was happy to report that it was clean. Linens were clean with no spot. Bathroom: Ample towels for our triple room and tub/toilet/sink were all clean Sleep: Mattress was really weak and not supportive. Final verdict: Cheap rate central location. Our room was clean and better than other reviews. So go with an open mind. Otherwise try looking at Premier Inn as well.,SFOtravelguy
UR65395469,2010-26-May,Hotel is very run down inside and out - reception and bar ok but rooms tell a different tale. Bad need of a paint and new furnishings - although was clean enough. Staff would need serious customer care training!! On arrival were giving our key and that was it. I asked were are the rooms he just said that way - no help at all. Next morning was hectic at breakfast people queing for 45 minutes and staff VERY ignorant. Save yourself the money and eat elsewhere breakfast bit rubbish. It is close enough to the station and we got cheap deal so sort of weren't expecting much anyways.,kellymoy
UR59579081,2010-26-March,Stayed here for 5 nights on a self funded business trip hence need for Budget Accom. Indeed it was cheap but that's the only thing that can be said for it. It was more like a Youth Hostel overrun by foreign youths who were loud and noisy into the early hours either in the corridors or outside in courtyard. Rooms are also very tired Lift capacity also inadequate esp when foreign students ignore the stand in line principle. If you do stay here insist on being accommodated on a floorr that doesn't have youngsters on it and ideally try for courtyard rather than road ( very noisy also) outlook,smanamana_10
UR80840067,2010-24-September,My first stay at a Travelodge which I assumed was a cheap and cheerful chain of clean and comfortable modern hotels. Wrong! First impression of this hotel in one of the roughest areas of Kings Cross was that this drab depressing building looked like one of the worst East German hotels prior to the fall of the Berlin Wall. I did not get to see Pentonville prison in which is nearby to this Travelodge but it cannot look any worse! Rough reception area crammed with foreign students trying to check in with one harrassed receptionist also trying to deal with a client who wanted his money back because his room stunk and the basin etc was dirty. Arriving early prior to check in time I was charged 5 to rent a locker to store a small case and if you want to get at it later to retrieve something that will be another 5 please! Elevators and stairs were really filthy and corridors uncleaned. Fearing the worst I was pleasantly surprised by our 3rd floor room which was spacious and clean with a nice bathroom. However bed was very soft and uncomfortable with a mattress that had obviously seen a lot of action and sank in the middle. Breakfast was adequate but shambolic with initial problem for us because the receptionist at check in had not presented us with the required voucher for the inclusive breakfast requiring me joining another queue at reception. Breakfast room overcrowded and inadequate for number using it. I would have thought that Travelodge would have unloaded this ghastly place years ago - perhaps the Prison Services might be interested in purchasing it to help overcrowding at nearby Pentonville - as it can only damage their reputation,HytheTony
UR84655059,2010-24-October,I used to always stay in Travelodge when coming from Paris for a week-end or longer. The rooms are small and the bathroom was smelly. They gave us a room right next to the street so when there is traffic too much noise. Worst is I have noticed that kettle for hot water was missing. I told it to the cleaners and also at the reception. I kept asking for it twice everyday patiently. The day before I check out a guy at the reception rudely made me understand that my request was vain. I was there for notting hill with a friend. There are few details but they are things that you expect not to mention.,damiancham
