review_id,date,content,author
UR59383541,2010-23-March,stayed in this DUMP 5 nights 'that could be a record' with friends16th-21st of march. i kid you not 4 hours in line to check in. thats after a 10 hour flight. i would safely say the staff never got a training day in their life so rude and totally ignorant its beond words. finally got so called rooms on 3rd floor. i nearly fainted when i looked in. now i stayed in hotels all over the world and put up with all sorts but this place takes the biscuit. its filth every inch of it. i'm sure any american who stayed here is very embarrest. it was my friends first visit to the usa and it was not pleasant to say the least. its to late to send in the leigons of cleaners thats required just tear it down. its not a hotel. i felt cleaner sitting on a bench in central park. as for the safety boxes thats a laugh too you will have a job getting your own money from them because the staff are get this 'to busy'. please guys dont bring your wife or espically kids to this dump. i showered at a friends house in queens every second day. if you like filth and grime you'll fit right in other wise stay in a bin in central park its cleaner i mean that. i love new york city and will be back but not in this dump,bunnyboy46
UR72029627,2010-23-July,The paint was peeling off the walls. Bathroom has mold growing in the tiles and ceilings. The shower head leaked constantly and there was no bathtub. The shower stall was badly rusted. The carpets were dark and filthy. The room was dark and musty. My bed was too low to the ground and the matress was extremly soft and gave me a backache every night!,tbumbrey
UR90528764,2010-23-December,Don't be fooled by the dazzling foyer/lobby. This Hotel could be great but has been run into the ground. There appears to be no attempt at a major refurbishment of even a lick of paint. The brilliant location cannot hide the fact that the building needs serious attention. There were cracks in the bedroom walls wallpaper was peeling the shower room sink was off the wall and dangling by it's legs. The beds and cupboards haven't been moved in months so the floors were filthy. The windows didn't close making the noisy air conditionning/heating redundant. The electrical sockets were alarming to look at or use. The hardworking cleaning staff always did their best to make the room presentable and the bathroom towels were perfection. The Manager of this Hotel needs to seriously consider whether it wants to run a high class hotel or a slum! I won't be booking a room here again.,strooka Posted by an OctopusTravel traveler
UR62261017,2010-23-April,I was one of the unfortunate people stranded in New York with my son and two friends when the Volcano erupted in Iceland. We booked for several nights as we didn't know when we would be leaving. We stayed 1 night and couldn't wait to get out of the place. I first thought I was walking into the ticket office at Central Station no correction Central Station was much nicer. The hotel was old (which I could have lived with) but the room they put us in was awful. The windows were so dirty you couldn't see through them the walls were grubby and in need of a coat of paint the furniture was just a mismatch and the beds were hard The shower was dreadful with missing tiles,ice_dancers
UR56774271,2010-22-February,We stayed at the Hotel Penn as we were entered for the first time at the Westminister dog show. After reading many of the reviews about this hotel I can tell you they are are true. The third floor where were were given a room was creepy and looked liked a asylum as someone else described in another review. The front deck is of no help to anyone they all seem to be zombies is slow motion. I forgot my cell phone in the room and as I am hearing impaired I use it for a alarm. It was located in my pillow case set on vibrate. We called the front desk about an hour after check out and of course there was no phone found in our room. We were told to call the next day again nothing had been found. I don't know why other reviewers suggest this hotel is a good value with crappy rooms. There are other hotels in NYC much cheaper and I bet much nicer.....,Pyrviewsolan
UR53989078,2010-21-January,I was booked into this hotel by my company because of it's location (which is its only positive aspect). There always seemed to be many people in the lobby and at reception but I hardly ever saw anybody on my floor. There where very long dark corridors and I always half expected to see two little girls at the end of one looking back at me as in the movie. The room was big but old and dirty with paint peeling from the ceiling and cracks on the wall. The room had undergone some sort of redecoration because you could see lesser stained areas on the wall where there had previously been paintings or mirrors. The door looked as if someone had tried to get in using a crowbar. When I put on the air-conditioner it made the whole room smell like a fast food joint because of a nearby restaurant. I can safely say it was the worse hotel I have ever stayed in.,ElQuerido
UR56708140,2010-21-February,Paint pealing from the ceiling and walls. Tubs you would NEVER set foot in. Unexplainable stains on the rugs and walls. Filthy restaurant. All I thought about was bed bugs and getting out of there. Um.. nice looking lobby and great location. Don't stay at this hotel. Spend more money and walk!!!!,upterry
UR90420179,2010-21-December,This was supposed to be a "girls weekend" before I have my baby and instead it put the biggest wrench into our vacation. We had an issue with our credit card for incidentals upon arrival (they wanted to run $40 on a card) and couldn't get a hold of my husband I asked if we could just check in pay the hotel room charge in full pay the $40 in cash and have the card info by end of day and they absolutely refused. The check in was at 3pm my girlfriend and I arrived in NY at 6am and had kept ourselves busy by walking around sight seeing in the cold we were very tired by the time we returned especially with me being 7 1/2 months pregnant.!!! I offered to pay them double they refused I offered them whatever they wanted and they said "no" and asked me to stand aside and wait. I asked for the manager who came out and gave me attitude and said that there was nothing she could do and if I went else where we would be denied because we need a credit card. I said "but we just traveled here from Canada where are we going to stay" and she answered "that's not my problem" and then motioned to the clerk to help the next person in line. I refused to leave the front desk and asked what did I need because I wasn't sleeping in the street. She gave me a list of things she would need jumping threw hoops is what she wanted and the only thing missing was that I light myself on fire. I walked over to the seating area and proceeded to call everyone I knew for help. By the time I got a hold of my husband with his credit card information (scanned copies of front and back of cc and of drivers license) that they wanted emailed I was told the manager had left for the day. She left and never said a word to me!! At this point we had been waiting an hour and a half. I asked to speak to whom ever was in charge they made me wait 20min before a man emerged with the same "I'm not going to help you" attitude. I just stood there at the front desk waiting. I told them this was hard on my feet but this fell on deaf ears. They would usher me aside and move on to the next person in line. When we emailed them the info they wanted more when my husband emailed more they said they didn't receive it. I asked to speak to the manager and he just all together stopped coming out from the back (he never stayed at the front desk to help solve this small issue). We were never shown any courtesy manners or respect. We were cast aside ignored and treated badly. We were just so tired and grateful that one person took pity on us at the front desk and helped me until he was finally pulled from the front and made to stop talking to us. We have no idea what we could have done to be treated so badly. The only reason we stayed was because the temperature was freezing all other hotels were booked and I wasn't about to go lugging around my bags in NYC at this hour trying to find somewhere to stay. Just when I was so tired frustrated and about to start crying my husband called me and said he had called the hotel and yelled at the manager to check us in that I've been up for too long and that this isn't good for the baby I'm carrying. I walked over to the front desk for the last time and a young man who wouldn't even look at me signed us in gave me keys and then gave me a receipt and then looked past me to help the next person. No "I'm sorry for the wait" there were no apologies given there were no words exchanged. I felt like I was in the Twilight Zone of the worst hotel experience of my life....and I've traveled! I've done cheap hostels high end luxury hotels in Europe South America Canada different parts of the US and never once in my life has this ever happened. This whole ordeal took almost 4hrs!!!! In the end we ended up having a half hour to get ready and then have to leave for our Broadway show no resting no showering no relaxing before the show as we had planned. It put our whole trip off and we never really recovered from this. I dreadfully regret staying at the Penn and don't recommend it to anyone.,pregnantatthepenn
UR59084994,2010-20-March,So I picked this hotel because it was close to Times Square and across the street from Madison Square Garden and close to Penn Station. When you first walk into the hotel it's very nice and looks fancy but then you go to your room and it's completely different. There was a nightstand and a desk and they were covered in dust. The beds only have flat sheets so if you toss and turn at night the sheets come off the bed oh and there were tears in the sheets and holes in the blanket. I was there for four days and they only vacuumed once and the hair dryer was broken. So yeah..GREAT location but that's about it..,GizemU
UR68075840,2010-20-June,I would never stay in this hotel again. EVER! The rooms are horrible beds are not comfortable and the bathrooms were not good either. The shower felt like it was a fire-truck hose! The towels were small and didn't really dry you up and the door to the room looked scary - like you were being locked up in a safe. The only good thing about it was that it was right across the street from Penn Station and Madison Square Garden but I'm sure there are way better hotels that are also close to these places.,vbravo83
UR71681758,2010-20-July,Hotel Pennsylvania was awful. The check in and check out times took 2 hours each an no matter what time of day there was always a long line and only 1-3 people working the front desk. The website says it is a historic hotel which has been renovated and it is completely untrue. The hotel does not even have a public restroom in the lobby.The hallways and rooms smelled like must the rooms have old dirty brown carpet the walls look like they have never been painted the beds were very small and uncomfortable the bathroom ceiling was full of mold the shower was dirty and the hair dryer even caught on fire. The website said we would receive a free continental breakfast however it failed to mention that this was only true if you were part of the "500 club". We had to pay to check our bags and then we had to bring them down into the creepy basement to drop them off. We tried to complain and were hung up on by the front desk staff and even the manager. They kept telling us to take up our complaints with "Expedia". I would NEVER stay at this hotel again.,Lindsay027
UR81794296,2010-2-October,Not worth your money. Really long lines just to check-in fortunately we were given a room immediately after check-in others still had to wait for theirs. Thanks to the Fil-Am lady at the counter. Our hotel room looks & smells old. The bed was a little too small for both of us and we're just average built..,earthhaven
UR62996588,2010-2-May,This was the worst hotel i have ever stayed in. Even though the check in was quick and the person i was dealing with was very nice i knew i made a mistake choosing this hotel when i saw the hall ways which were dark and dingy. The next thing were the doors which looked like coffins. The walls in the room had cracks the bathroom was ok but whole room had musty smell. The tv was broken no remote called the desk told me someone would be up to help me but 30 minutes later no one came had to go down to main reception desk to ask what happened to my request said someone would be there in a few minutes when they finally showed up they told me i would have to wait till next day to get a remote which to me is unexceptable.finally next day fixed it. Also be aware if you have a cold day and night they have no heat we froze this was in april. they told me it was the spring season so no heat. I could not believ it. The blanket on the bed is so thin never again will i stay there.,irisblue55
UR69487052,2010-2-July,I would strongly recommend against staying in this hotel. I have travelled a lot and slept in all types of hostels boarding houses bed & breakfasts and hotels - this is the worst place I've ever had the misfortune to stay at. The lobby is completely open to the public (overfowing from people just out of Penn Station looking for a place to take a break) the staff is rude check-in takes forever you have to use pre-paid wifi in the lobby (the signal didn't make it to my 3rd floor room). However the most unpleasant part of the stay has to do with the room itself. Windows can not be opened and haven't been washed in years paint is chipped and peeling rusty shower fixtures the dark-brown carpet is scary and there is a strange musty lingering smell that permeates everything. It's worth a visit downstairs to see the safety boxes - if I hadn't been travelling alone I might have seen the humor in it all but one look at the broken safe doors hanging on their hinges made me turn around go back upstairs and hide my computer and passport in a drawer and hope for the best. The highlight of this horroric stay is a walk down the halls. The stained carpet and poor lighting are downright creepy (remember "The Shining"?). There have got to be better places in the city for the money I paid. The location is the ONLY good thiing about it however with the good subway system what's the big deal about being right across the street from Penn Station?,Loli14
UR73453131,2010-2-August,Pictures are certainly deceiving!!!! This was the worst hotel on the planet!! The location was great and even the outside of the building and the lobby were nice but as soon as we stepped off the elevator...hello hostel. No worse than a hostel!! The hallway had a feeling of a mental institution and the floors and walls looked as if it were the murder scene from an episode of CSI NY or SVU!! Talk about scary!! The room was so small we couldn't even unfold the rollaway bed and the bathroom...terrible and tiny!! And the air conditioner was broken- during summertime in NYC!! And to top it all off they charge per bag to store your luggage while most hotels store it complimentary...but not this place! I could go on forever. There are not enough words to describe this place...but "worst place imaginable" definitely sums it up!!,ans02c
UR59020047,2010-19-March,the hotel looked grand from the outside but inside was dropping to bits. rooms n corridors were scuffed old and dirty looking plaster hole 3ft x 2ft on 14th floor rooms were shocking paint coming off the ceilingcracked basin in bathroom and to top it all bath tap came off in my hand. oh and i forgot draught in the room window was stuffed with loo paper my advise dont go there i asked for a upgrade and what i described above was the upgrade!!,groovyma68
UR71544238,2010-19-July,This hotel was sooooo freakin awful that I just HAD to come online to write a review which I never do! Don;t take me worng its in the heart of NYC so very convinient and the price was a steal for us just $98+tax. BUT -- the experience was something to remember making it the worst hotel in the world I've ever stayed in. We waited for an hour to check in which is ok given its busy. then when we got the room first it was very dirty all the bedding on the floor etc. went down changed the room 2nd room was filled with cigarette butts all over. changed it again 3rd room - bedding all on the floor once again - this was after the manager promised its a very nice room. all this happening while my 11 month old waits in the car in 90 degree wather outside after coming back from a 1 week stay at a hospital. you can imagine the agony. anyways the 4th room finally worked with no working tv that they fixed after 3 hours. i was hesitating to lay down on the bed cuz it just didnt seem very clean. the whole floor was very suffocating we could not wait to get out of the room. i am hoping i never need to stay here again.,CoolCrabber2k
UR53884785,2010-19-January,It's old ugly and dirty! Rooms don't have LIGHTS safe refrigerator nothing! They don't have wi-fi (just if you pay A LOT with credicard). At check in you have to give to them your credicard number and they keep it. They don't have breakfast. The rooms are dirty ugly old and REALLY DARK because they just have one lamp no lights! The beds are small! The staff is terrible too they don't even carry your bags. Terrible hotel and it's the same price as Roosevelt and others (a lot better). The ONLY good thing is the location but definitely it's the worst hotel I've ever been in my whole life even hostels are better,patyler
UR75856419,2010-19-August,I have stayed at this hotel several times and each time have either gotton or been upgraded to a decent room. At this hotel decent is used "lightly"! All me and my daughter were expecting was clean linen (had a king bed in which had a half sheet...possibly twin lying crossways of the bed and only covering less than half of the mattress) The bedspread "stunk". and the bathroom was horrible. The sink had cracks in it the old tub had lost much of it's iron coating around the drain. There were no face cloths no pen no paper and missing hardware in the room. The walls were filthy and spots were all over the walls as if someone attempted to "spot paint". If at the very least the room was freshly painted and fresh linen were present it could have been do-able. The bed was extremely hard so do I recommend this hotel "HECK NO'"!! Is there anything positive? Yes the location is awesome!! If you can get a discounted price well under $200 just insist at check in that you recieve a decent room. Afterall there is a certain amount of satisfaction that even the worst hotel owe their guests. If you choose to stay....there are "FEW GOOD ROOMS" you just have to demand one and if you don't get it...DEMAND A REFUND!!! In my case I wasn't able to get anyone on the phone to assist me and after a 14 hr. long drive to the city I was too exhausted to hassel with it. We could not sleep with the bead spread  however used the top sheet and the half sheet to bed down on...Uggg!! The next day I DEMANDED a do-over and received another room at "no charge" however I did incur a $40 per day parking fee. So now you have it!!! IT'S YOUR CHOICE!!!,CChattam
UR64547472,2010-18-May,Facts: took 40 minutes to check in (this place is hugely popular with foreign travelers) the room was miniscule and quite dark you had to find the right spot on the TV remote or you were stuck on one station no bathtub for the shower so the whole room was wet and no room service. The good part is the great location to virtually everything and nice people for the most part (one of the bell people actually yelled at me for not knowing the cross avenue when I asked for directions). If you just want a covenient place to crash it's fine; just don't expect anything more.,ciaobla
UR67850161,2010-18-June,I stayed at Hotel Penn for 1 night because I knew I was working late into the night and didn't want to take a train home at 3AM. I wish I listened to the reviews. My boyfriend and I stayed in the hotel and while we got a wonderful rate the room was just filthy. I could not believe my eyes when I walked in. First of all it was the size of a closet (which did not surprise me) but the bed was so tiny! There was writing on the walls... Paint peeling on the ceiling... dirty shower... hair in the sink... It gave me the creeps just being in there. Walking through the halls I felt like I was in the movie "The Shining." It took me about 30-40 minutes to check in. The staff was very friendly and the lobby is nice. That's pretty much where it ends. Oh and the restaurant that's in the front of the hotel? $18 for a plate of eggs is a bit too much for me and I'm used to NYC prices. Walk to 8th ave and go to the diner there if you end up staying at this hotel! But please don't even bother!!,Delps
UR56435416,2010-18-February,This hotel was part of a trip my wife and I bid on at a charity auction for our local Boys & Girls Club. It was a 2 night stay combined with tickets to see the Rockettes Christmas Spectacular. We arrived at the hotel started getting creeped out by the lack of security as we took the elevator up to our room. The room was just unbelievably gross. People have already described the lack of cleanliness and lack of maintenance. Called down to front desk and was told the hotel was full and there was nothing they could do. I went down to the payphones in the lobby and called Doubletree Guest Suites in Times Square. They were full. I explained that I was a past guest and I needed to be rescued from a disgusting hotel and proceeded to tell them my tale of woe! The clerk said let me see what I can do. She came back on a few moments later and said I was all set and to come on over! I checked out of this flea bag and went over to Doubletree where they gave me a beautiful room at an unbelievably low rate.,Hate2Pay4Parking
UR61815463,2010-18-April,This is the worst hotel I have ever stayed in. The staff were terrible the room was filthy and the shower didn't work. The hotel also feels less than secure. Awful experience. I even paid to fly home a day early to avoid another night in this fleapit. If you are visiting NY for a break/holiday staying here will ruin it. There are plenty of better hotels in NY for a similar price.,molliemouse
UR67817647,2010-17-June,What a nightmare. I was forced to stay in this dump for 12 days for a business trip. My finance director prepaid otherwise I wouldn't have made it past check in. In a nutshell my room had blood stains on the carpet the electrical sockets were dangling from a wire the shower head was an exposed pipe The telivision had rabbit ear antenas and did not get any recption and the hotel was absolutely filthy- not to mention the cockroach infestation and the bedbugs. The staff are virtually useless and frankly I feel sorry for them as the 2 hour long line ( literally) is person after person complaining and screaming. The location is convenient although not a particularly fantastic part of NY. Its directly across the street from Madison Square Garden with access to public transport including commuter rails to Long Island and New Jersey. A close proximity to times square- not something I was interested in. However if that's what your into May I suggest ANY OTHER HOTEL IN MIDTOWN!!,johnandjaime
UR79822258,2010-16-September,my daughter and i stayed here from the 8th sept to the 12th lets say check in should have warned me (natasha) the check in clerk was rude dissagreeable no manners or customer service. well where do i start we walked into the room it was DISGUSTING there was paint peeling from the walls the aircon looked so prehistoric it sounded like a mack truck in the room black mould over the airvents dusty smelling the skirting boards looked like they had never ever beenjcleaned dust all over the window sillplaster falling off the walls. dust and i mean lots of it on the lamps and tv and cabinet.. now for the good part the bathroom its was so old and dirty the toilet was an old fashioned pottery one with the squarish base well it had pubic hair dust and wee still on the bottom from many previous guests there was mould in the shower the tap would not turn of properley so it dripped and the water would not drain away so you stood in about a foot of water everytime you showered as i was busting to use the bathroom i did not register to we would not be able to change rooms when we went back down to complain yes natasha again we were told we couldnt i told her it WAS DISGUSTING BEYOUND WORDS.. it was only the location that did any thing to this place right opp madison square gardens and 5 to 10 walk to times square.. do not stay here pay more and go elsewhere this place i would not let my dog stay in..,Paula01
UR64309457,2010-16-May,The staff is nice and responsive to questions but you get what you pay for here. The area is a tourist trap the rooms are tiny and ours smelled like sewer. The "free breakfast" was nothing more than stale bagels and the internet is unreliable. This hotel is not horrible or dirty but you definitely get what you pay for.,elizabethaberk
