review_id,date,content,author
UR125846228,2012-9-March,After reading the scathing reviews from our fellows on Tripadvisor I called to cancel my reservation for late February. Again worried about all the issues regarding this hotel I actually wrote down the cancellation confirmation number and name of the reservation agent. Of course on my next AMEX statement is the room charge from the hotel. When I called the accounting department at the hotel to give them my cancellation confirmation number I was told I had to write an email explaining "my error" and why they should refund the charge. I requested and received the hotel manager who basically told me there was nothing she could do. I told her I would be contacting AMEX to resolve the issue and instead take my time providing my scathing review of her hotel WHERE I DID NOT EVEN STAY! I am personally amazed based on the negative reviews at this hotel that it even stays in business.,Luv2SkiTahoe
UR122792302,2012-8-January,it is a very good locationbut so are the ears on the side of my head and they are cleanwhen you read a review about this hotel you realize it is as bad as the sayits not cheap its dirtyand again filthy carpethole in tub that leaks on floor when usingmold does not describe mini frigdirty walls dirty every thingI would(will) pay more next time in New York we did finally decide it was better than camping if you did not have a tent and it was cold and rainy.Oh the best part about this place is no one caresit is what it is dirtyfilty moldy with incredibbly dirty carpet and we had two rooms for 3 nites and we cold not decide which was worsteven though my sons room wash basin was full of water that someone had brushed there teeth and spit outsink did not drain time we wher there.,daniel d
UR122735433,2012-7-January,Let's get the location thing out of the way: This hotel is an an awesome awesome location: across the street from Madison Square Garden right near 1/2/3 subway line. Stores restaurants Midtown attractions - you're in the center of it all. Don't stay there. This hotel is more than 90 years old and it shows. It's not a charming historical hotel but a huge and badly maintained dump. The room I've stayed at had stains on the walls and the carpet was weird the TV was an old CRT and some of the wiring was carelessly done. Lighting was inadequate room was almost always dark. The bed seemed old as well not very comfortable. The window which overlooked one of the folds of the hotel and not the street was thin enough to allow a lot of noise in which is a problem in the city that never sleeps. The bathtub had a huge ugly stain around the drainage hole and the shower head was uncomfortable. That said I wouldn't call Pennsylvania hotel unsanitary - no bed bugs the bed sheets were clean and so were the towels. Another lackluster aspect was the customer service. Due to unforeseen circumstances my girlfriend needed to book the hotel for me and she has done so with her credit card since I didn't have mine on me. When I checked into a hotel in DC with the same situation they were friendly and just asked me for a 100$ security deposit which I was happy to provide. At Penn they refused to do that claiming it's the hotel policy and they're not to blame it wasn't made clear when I ordered on third party website. The supervisor even had the audacity to answer the question "Where does it say that I have to have a credit card" with a vaguely threatening "You don't wanna go down that road with me". In the end I was only allowed to check in after my girlfriend photographed her cc and drivers license and sent it to them by email (How very secure). I understand that this hotel is usually one of the cheapest in Manhattan but seriously it doesn't worth the 20-40$ a night you'll save if you're a tourist. If you just need a place to stay at cheaply near MSG well it beats staying on the street.,DenisVitchevsky
UR124253151,2012-7-February,Dirty and unkempt. Dust everywhere air con broken (front falling off) and cracked toilet seat. Decieving from the outside and reception. But central and easy access to everywhere either on foot or subway. Would we go back to that hotel - No.,TheHortonsWarrington
UR127425968,2012-7-April,I stayed at the Penn in July 2012 and I had an awful stay. I was happy when my stay ended. The room was filty the shower didn't work properly and it was smelly all over. There was very rude staff at the front desk. Myself working as a hotel manager was treated in a very bad way. The queue upon check-out time was huge and I was waiting to do my check-out for approx 1 hour. When it was my turn three young guests went to the desk and I asked them to go an queue as well as everybody did. The receptionist was shouting at me and insaulting me. She told me that it is her who is deciding who will be next at the dest and who has to wait. There was one manager I suppose it was the GM of the hotel watching all the people queueing and was just standing there. One guest asked him for an information and he sent the guest to queue as well. What a horrible service from the top to the bottom... I will never ever stay there again,nahla1976
UR125715956,2012-6-March,I never go to the trouble of giving bad reviews to hotels restaurants bars etc. However in the case of Hotel Pennsylvania I'm more than willing to make an exception. This place was/is an absolute dump. I understand the appeal of an historic hotel in NYC but I have no tolerance for old ratty linens dirty bathrooms non-working lights missing amenities (i.e. ironing board) and just a general lack of being with the times. The room was $120 for one night which by NYC standards is cheap. Holiday Inn Express was the exact same price and I wish I had gone with them instead of Hotel Pennsylvania. I'm not what anyone would call a frequent traveler so any hotel losing my business is far from an issue for them. However I hope I can influence anyone else that is even considering this place. If you enjoy staying at any hotel with modern amenities and acceptable upkeep/cleanliness DO NOT stay at the Hotel Pennsylvania. Consider yourselves forewarned :),Patrick M
UR124211996,2012-6-February,The lobby of this hotel is beautiful. But you will soon realize that is where the beauty ends. The whole building hasn't been renovated since who knows when. The walls are paper thin. The bathrooms are old tiny and drafty. The carpet looks like it was laid in the 60's. It's peeling back everywhere. The walls are scuffed old and dirty. The location of this hotel is great. It's right across from Madison Square Garden and just a few blocks from Times Square and everything Midtown has to offer. If you are a young person coming into the city for a concert and just need a place to crash this will do the trick. But if you are looking for a comfortable clean hotel where you can stay for a vacation this is NOT it.,lbourg1
UR125583672,2012-4-March,I stayed at this hotel 2 years ago and have never got over it. Having visited NY last month staying in the superb Hotel Park South I felt compelled to write a review. This hotel is atrocious the staff are rude aggressive and totally disorganised. The rooms were disgusting upon arrival we were faced with dirty unmade beds filthy carpets wet used towels heaped on the floor and as for the bathroom dont go there urghh! How they get away with it I dont know the management should be ashamed of themselves. Oh I nearly forgot to add that the Westminster Dog Show being held in Madison Square Gdns hence the hotel was full of dogs and their owners which resulted in dog wee and poo in the reception area corridors and lifts honestly I'm not exaggerating. Do not stay here ever!,Cathy F
UR127250234,2012-4-April,We took a school trip here from the UK Students out in rooms across all floor not together not enough beds some rooms hadn't been cleaned from previous guests.Dogs all over the hotel. Rooms smelt showers disgusting. Tramps and druggies hanging around in and outside of the lobby. Staff slow rude unhelpful and did not resolve issues in fact at one stage one of the "managers" was hiding from us in the back. Some staff I would even describe as agressive. Location didn't make up for the awful hotel and staff. Stay somewhere else.,Lindsay E
UR126948643,2012-30-March,From the beginning Hotel Pennsylvania disqualified itself by (in the rudest possible way) demanding 4 dollars per suitcase for holding them for one hour. (The room wasn't ready so we had to pay extra.) That is more or less the quality of service for this hotel. Rude staff who is absolutely unwilling to help let alone send you a smile seems to be company culture. We don't expect that to change sorry. (And we are positive people who always meet people with a smile. Only one receptionist returned that gesture and did what he could for us. As you will know from other reviews the hotel is quite run down. Rooms are dark brown with insufficient lighting and not in any way renewed for decades. Off course there was neither fan nor air condition in the room. The socalled business lounge contains of two coffee machines two computers of old age and generally old fashioned cafe furniture. The carpet was totally worn down. The two computers was at all times occupied by kids and young people who used them for Facebook for hours. The hotel doesn't seem to care for the travellers using mobile devices as smart phones or iPads. The only way to get your own device online was by cable in the room at USD 11 plus taxes. And we even paid extra for free wifi and a superior room! This had been confirmed twice to our travel agent thus making us choose HP because of the location. Breakfast is served in the socalled business lounge and consists of rolls croissants jam and coffee plus a watery orange cordial. No yogurt no fruit no juice no milk no cheese no meat - nothing but rolls jam thin cordial and coffee. We even got a "special deal" paying 208 per night for a double. Or ... no ... perhaps we didn't. Because when we arrived we were told that the rate differed from day to day ending at 262 dollars per night. Plus taxes of course. And this was late March 2012 implying low season. Wonder how much they're gonna charge you in July? NEVER get anywhere near Hotel Pennsylvania.,SteenKR
UR127165056,2012-3-April,If you don't have allergies you might stand the stale air the tiles & caulking in the bath are cracking and loose There is mold stains all over the tub area including the ceiling. Make certain that you have flip flops to walk around the room as the rugs are very old and you'll probably get a fungal infection from the rug &/or tub area. It's noisy because the walls are so thin you can hear every word others say & I have moderate hearing loss. In addition the street is busy so you get the traffic noise too.,Sheryl C
UR123780688,2012-29-January,We arrived on a pre-paid deal and waited 15 mins at check in to find they had no room for us due to a convention that weekend. After about 5 mins they gave us room 1778. Having trudged down long corridors we were faced with a door with paint flaking off. Inside the room was a decent size but obviously had not been used for a while. Someone had raced up to open a window. Luckily the weather was unseasonably mild for January so we could unplug the heater that would have kept the whole of Manhattan awake all night! Paint was flaking off the walls and ceiling in the bathroom the toilet seat was stained and the toilet got blocked on day 2 and was not dealt with by the cleaners during the day so we had to delay our departure to the theatre to wait to get it fixed. We could have complained and others on our deal did but they lost a whole day of their holiday changing to various other rooms. Staff were not good by UK standards let alone US. It was just good luck that the weather was so good that all we needed was a reasonably clean bed. We have been to worse hotels just can't remember when!!!,Peter W
UR126738330,2012-27-March,I recently attended a conference that took place in the Hotel Pennsylvania. I got a great price ($119) considering the location and figured if the conference was happening there it would be fine. WRONG. The room was really horrible. The rug and bedspread looked as if they hadn't been updated in 25 years and maybe not even washed or shampooed in all that time. The bathroom was ugly but not too scary because the smell of bleach was so strong I knew nothing too bad could survive there. (I got a headache from the fumes though.) The walls were dirty and the room so dark it would have been depressing even if it had been clean. I checked the sheets for bedbugs and they were clean but I was still worried. In the end I survived the two nights without getting bedbugs or any other disease I know of and the location really is fantastic. If you must stay here bring slippers because you won't want your feet touching the floor don't spend any more time in your room than you have to and keep your expectations low. If you pay very little you will get what you pay for!!!!,NancySantaCruz_CA
UR123622098,2012-25-January,DO NOT SYAY HERE - Ever We paid through our Travel agent $430 per night for 3 people. The rooms are disgusting. Please look at the photos.,michele8040
UR126582851,2012-24-March,By far the worst hotel I ever ALMOST stayed in. We checked in in a fairly nice lobby and then proceeded to go to the room. All the doors looked worn and had paint falling off. First clue. There were people pounding on doors Second clue. There was the smell. Third clue. Then the cu-de-grace the room!!!! Where to start? The carpet that hadn't been cleaned maybe ever? The bed that sagged worse than a 20 year old horse? The feeling that bugs were climbing up your back as you stood there? Or the creepy door that led off to some unknown room with an adjoining door without a lock? Safe to say we got out of there pronto. The girl at the front desk was very non chellant about canceling the booking. Like she knew it would happen or has happened many times before. If I could rate this -1 I would.,churdles
UR126489404,2012-22-March,This scam of a hotel took $240 off my credit card without telling me they were going to do it. When I noticed that the money was missing and called they said it was in case I watched any movies. First they told me I would get my moneyback after 5 to 10 days then they said 7 to 10 days. Apparently the desk clerk was supposed to inform me they were taking the money. He did not! The rooms are dingy my sheets were filthy and looked like they hadn't been washed the bed was hard as a board. I will never ever stay here again.,wsheldon518
UR125030497,2012-22-February,When booking a group trip to the hotel Penn I was not put off by the bad reviews on this site as I knew students not want to be 'told off' for being noisy or up late.However there were far more worrying things happening than just nasty rooms. We were met by the Bell Captain on arribal who had all our keys ready which was very appreciated. On inspection of the rooms however we had been allocated 18 twin rooms and 4 single rooms but booked 9 tripples 9 twins and 4 singles. We needed accommodation for 9 extra people! I returned to the reception spoke to the manager to sort this out. She informed me that they were going to put cots in 9 of the twin rooms. This was just not acceptable as once this started to happen it was very evident the rooms were simply not big enough to fit extra beds in and still have floor space. One room looked as it it had one massive bed covering the whole floor. I returned to reception and told them this was not going to work and asked them to find us 9 tripple rooms. The hotel issued us with new rooms for 3 of those allocated on another floor but after inspection they were the same rooms but on a different floor. I returned the keys and asked them to try again. The hotel finally managed to find 2 tripple rooms but had to squeeze the extras into the rooms we had. We still needed to find rooms for 4 students so asked the hotel if they could give us an extra two tripple rooms. They refused and said that beds were being sent up to the rooms we had. One of our lecturers had enough of this situation and gave his own room up for 2 of those students and went to find another hotel to check into. We then convinced the final 2 students to bed share with their friends in the rooms they had as it was just pointless to try and find any other solution to our problem as it was now very late in the evening and students wanted to go to bed. In a nutshell we asked for and paid for 9 tripple rooms we eventually had 2 and the rest had to sleep in a cot or bed share. One member of staff stayed in another hotel. We did not engage with anyone from the hotel after the first evening as it was an absolute waste of our time doing so.,jasonbevan
UR126425940,2012-21-March,I just recently returned from staying at the Hotel Pennsylvania New York. I was concerned about staying here after reading some of the reviews but we met a nice gentleman on the plane who asked where we were staying and when I told him he said "that is a very nice hotel" I asked if he was sure because some of the reviews were a little sketchy. He commented that I shouldn't read reviews. When we arrived I was pleasantly surprised as the lobby area was nice and grand. That wore off pretty quick after it took 45 minutes to check in. Upon checking in we were told that even though we had reserved a King size room there were none available and would be given a double instead. I asked if there would be a price reduction and was told that since I had prepaid there was nothing that could be done about the price. It was late and I was tired so I just let it go. The clerk then said that we could look into changing to a king size room the next day. As we proceeded to get to our room I saw what others had mentioned in their reviews. The hotel has not been updated and the carpet and walls were dingy. As we opened the room I was disappointed. The walls had paint peeling and the bathroom had not been serviced. I called the front desk to mention about the bathroom and the person on the other end of the line seemed bothered. After 1 hour maintance finally took care of one problem. When I requested housekeeping I felt that I was a bother but was told they would be right over. Needless to say they never appeared that night. I was so distrubed that I slept in my clothes. The next day housekeeping did come but my request to change to a king room was once again denied. It was finally on my third night my request to change to a king room (the one I had reserved) was granted. I will say that the king room was in much better shape than the double room we had been staying in. The walls are very thin and you can hear everything. Now the positive thing about the hotel is it's location. It is located in Midtown Manhattan and is right next to the subway. There were always people and police officers around so I always felt safe. Would I stay there again? Probably not.,maddiescoots
UR124979216,2012-21-February,We came home with horrible bed bug bites. The heater didn't work beacuse the outlet didn't work. The bathroom was filthy. The only good thing was the facility for the dogs during Westminister.,KathyL909
UR123374624,2012-20-January,I booked 4 rooms in mid December for 5 days. It was not cheap total was 633 per room. Our rooms were all differant 2 were big (one massive) and 2 very small. All 4 rooms had damp patches on walls and ceilings very bad electrics and stains on carpets and beds. My room had a large stain which smelt of vomit. The windows were very dirty and mine woldnt shut. Not good in December. I had asked for all of our rooms to be next to each other ( had booked tis in August) however although all on 7th floor we were spread all over it. The corridors were dirty peeling paint and damp. No wifi in he rooms also electric sockets right above the sink a small splash of water would have gone in it. Whilst downstairs outside on side entrance for a smoke I was offered sex and drugs by men and women. When I complained to the reception they said dont smoke! I pointed out that rentboys were in the lobby and they said "we get all sorts in here". It was only when I threatened to call the police that someone went over and asked them to leave. They were there the next day. Man at lifts is supposed to check only guests going up in lifts he never once asked to see our card keys. Our floor had several people wandering around at night who were clearly not guests and twice someone tried the handle to my room. This place is a rip off and filthy. Needs shutting down and refurbished from top to bottom. Staff were not rude just ground down. All I heard was people complaining about the state of the place and the lack of security. Someone was robbed in a corridor whilst we were there. There are also homeless people sleeping in the lobby.,Ben G
UR122410974,2012-2-January,There are a lot of hotels in New York so ranking it as the worst would be difficult to do. But I'm sure it would be among the leading candidates. I often travel to NY on business. Based on price and location one of our secretaries booked this hotel for our trip. The rate was low for Manhattan and it was located across the street from our client. So for cost and convenience it was a good choice. But it's not a good choice if: - You don't want to stand in line nearly an hour to check in - You don't want to stand in line nearly an hour to check out - You don't want to stay in soiled room - You don't want a permantly stuck open window during a frigid night - You don't to shower in a pitch black bathroom - You don't want to shave by using the light of your cellphone This hotel has become the butt of several jokes in our office since our trip. We feel like survivors.,TTGA
UR126328696,2012-19-March,I stayed here for a conference. The conference facilities were fine but the hotel rooms were dank and dingy. Broken tiles in bathroom. Not enough blankets. No wake-up service. I met others at the conference that stayed a few blocks away and walked over. I would do the same next time.,PamandSam
UR123292722,2012-19-January,Very expensive but not very clean and staff are very rude to their customers. I would not recommend this hotel to anyone. by: Linda Evans Photos: 24,09Evans2009
UR124819337,2012-19-February,Worst hotel I have ever been to! We checked in Knowing this place was not the Hilton but we thought at least the room would be clean. The staff at the front desk were very rude and nasty with us from check in. We then went to our room and noticed that the lock was broken on our door. We called the front desk to ask if we could move to another room but were told that none were available. The manager advised us that they would repair it in the morning. A little later that evening we decided to go to bed I noticed a pubic hair on the sheets. I then moved all of the covers and found a pair of woman's black panties in the bed! The panties put us over the top. We went to the front desk and demanded a refund. Only after they saw the picture on our phone of the panties would they check us out without penalty! Never stay here. It is a filthy hotel. I think the homeless shelter would be better than this dump! I don't think this place deserves 1 star but a 0 is not an option!,Cook4815
UR123253296,2012-18-January,We booked the hotel through their website before traveling to NYC. We were using a card with my name on it but for other reasons I would not be have the card with me when traveling. I called when making the booking to find out if this was okay. If it wasn't I would have booked using a different card. I was told by a young man over the phone that this would not be a problem. When I arrived after waiting in a long time in line I made it to the counter. I was asked for a card and when I said I told the woman at the counter what happend I was called a liar before I even got out what I was trying to say. She refused to even listen. I asked for a manager who I assumed would be upset with the attitude of her employee. After another long wait the manager came over and loudly began arguing before I could even speak. I just put the room on another card and moved on. The hotel was dirty and smelled but I didn't expect much because of the price. My main concern was due to the complete lack of civility from the staff. I hope this issue is addressed immediately this was the worst customer service experience I have ever had.,sean B
UR124784902,2012-18-February,omg where 2 even start..this is the dumpiest hotel i have ever been in in my entire life..i brought my 3 daughters here 4 a family vacation hoping 4 some relaxing yet entertaining fun..we couldnt relax cus the room was so disgusting we didnt even wanna sleep on the beds let alone use the restroom..there was drink or food spatterd all over the walls the curtains or bedding hadnt been washed in i dont know how long..the carpet was filty n cobwebs all over..i complete dump..i felt cleaner out in the city then i did in the room..n the staff omg how RUDE!! n these ppl r supposed 2 b professionals i tell u there was professionalism what so ever..the receptionist was a complete b*tch..the housekeepers were just as bad..the only thing this hotel has goin 4 it is the lobby area that is nice but plz dont b fooled they share it with alot of other companies that r down in that part but as soon as u hit those elevators its all gone n ur on ur way 2 HELL..if ur taking the trains its nice cus its just a matter of a few steps from there n that was the reason we took this hotel..plz walk a lil farther n get something nice its worth it trust me as i wish i had...n 2 top it all off my daughters ipod was stolen from our room n nobody would do anything bout it...so there is nothin good bout this place save ur $$ n the aggravation ur gettin get from here n book somewhere else...,Missmomof3
