review_id,date,content,author
UR61950252,2010-19-April,My partner and I had been staying in another New York hotel on holiday when our flight was cancelled due to the volcanic ash from Iceland. We needed cheaper accommodation than we had and the Hotel Riverside Studios was fairly close by and looked clean and was very reasonably priced. I had not read the reviews as we were in a hurry to get somewhere at a cheaper price. Initially this hotel looked better than I expected but it became clear that first impressions were deceptive. The room we had (a double) was absolutely freezing due to the fact that the shutters on either side of the air-conditioning unit which is fitted underneath the window did not shut completely so the window is effectively open all the time. I told the man on reception who looked at me like this was one in a long line of hassles he could live without and then showed me how the radiator worked although the radiator he said only works when the temperature drops sufficiently outside. He went and got us an extra blanket somewhat grudgingly but it didn't really help. The radiator finally came on at about 1 am I know not because the room flooded with warmth but because the hissing steam that came whooshing out the side valve woke me up and it was impossible to stop it. I would not recommend staying here with children because the radiator and the valves heat up to the point of scalding. The radiator went off after about an hour and the room was freezing again by the morning. The rest of the room was just depressing. The window looks onto an alley so it is very dark there are no curtains just some broken old blind. The bed is horrendously hard and there are no chairs to sit in. The only advantage is the sink which means you can spend less time in the bathrooms and on that note - The bathrooms are grim. I realise that sharing with strangers is never going to be the ideal situation but the bathroom facilities are just inherently dirty. The fixtures are broken the shower curtains are old and on occassion cling to you (very unpleasant). The floors are tiled and there are no bath mats or paper for cleaning the floor so the floor is always wet and dirty. There is a cleaner but I had to remove someone else's hair from the plug because the shower filled up when I used it. To top off this delightful experience one of the bathroom windows which is next to the shower is wedged open and appears to look on to a wall and a window which looks like it has been pasted over. It is not possible to pull the curtain in front of the window so I assumed I was safe to use it undisturbed. Not so! Half way through my shower on the second day I looked down to see I had an audience of one watching me in the shower lovely. The rest of the hotel is very run down and smells odd. I wasn't expecting luxury but it infuriates me that someone makes money out of this level of service.,PicklesMcGraw
UR67890355,2010-18-June,this is the most disgusting hovel i have ever stayed in we booked 3 nights but only stayed one and this was because all others were fully booked. it is absolutely filthy with windows that dont shut and electrical wires sticking out of the walls. please please dont stay here it will ruin your holiday.,lethba
UR87329764,2010-16-November,This Hotel was filthy the service was horrible and someone tried to break down our door. There is no security here whatsoever doors and hallway windows are left open and fireprotection is poor!!! There is only one puny lock on the door! When they tried to kick in our door I could see the light from the hallway!!!!!Don't at all costs do not stay here!!!,Mandiva333
UR87080037,2010-14-November,This was not my accommodation choice but I ended up staying here after a double booking elsewhere. Location is extremely handy for a lot of things and this is the redeeming feature of this place. Bedding and towels are clean and changed daily and I accumulated a lifetime's supply of soap and toilet paper in just a few days. TV & fridge a bonus. Bathroom evidently cleaned daily. No sign of bedbugs in my room. However the entire place is looking very shabby (unlike the pics online) and in need of a lick of paint and steam cleaning of the carpets at the very least. However if you are on a budget and want central Manhatten accommodation worth considering!,Paulskii
UR40411683,2009-9-September,this place is falling apart the rooms stink my room had punched in walls a windows covered by a plank of wood toilets and bathroms were filthy and we jus chose to shower on the last day thats how flthy they were wernt cleaned in 4 days...all bathrooms are shared website advrties wrongly...i acutally cried thats how bad it was... most hostels are better...it a illegal hotel meant for public renting and has WORKING MALE PROSTITUES staying there no joke...only good thing its in a nice safe area!!!!!,bull1345
UR50830130,2009-7-December,The sight of a run down lobby and bad smell did not fill me with confidence as I entered the Hotel Riverside Studios and as for the name it is indeed by the river right on the edge of the river but this does not make for a good view or good area. After a long and confusing walk around the hotel to our first room we were greeted by cockroaches leaping around as soon as we opened the door. This quickly led to us getting our second room which was on the seventh floor  which was a pain because the lift was not something you wanted to risk using. The carpets all had stains and the buzzing from the fridges and clunking of the plumbing went on all night. As soon as we could the next day we escaped to a better hotel after an awful nights sleep not sure what was moving at the end of the bed. The smell of the hotel remained in my clothes until I washed them. Do not stay here ever there is a reason why they always have vacancies.,kprior
UR39953436,2009-6-September,I have just returned from a visit to NYC after staying at Hotel Riverside Studios. If you are fussy about staying in a clean environment do not stay here. My profession means I travel a lot and I am used to very cheap hotels yet I haven't come across anything like this before. The room itself was big. Two double beds. An attempt at giving the room a cheerful feel with bright bedcovers was immediately undone by the massively uncomfortable mattress and wheels that meant the bed moved! I didn't dare sleeping under the covers luckily it was very warm during our visit. Talking of warm let me tell you about the air-con. It's a window unit that makes an ungodly sound and only when stood directly in front could the effects be felt but it did give small relief. The room didn't feel like it had ever had a proper clean. I wore socks or flip-flops when I was in the room as the carpet had visible stains. The sink was disgusting practically orange with rust and scaly taps that have long lost their sheen. There was a decent tv in the room which drowned out exterior noise - I often heard doors slamming during the night. The ceiling also had a lovely damp patch right above where I was sleeping a charming sight to drop off to. Now the bathrooms. I've seen reviews on this site complaining about the shared bathrooms frankly this is an oversight and complaining in unjustified. Complaining about the state of said shared bathrooms is totally justified - they were foul. I don't mean dated or aged I mean filthy. The bath looked like it hadn't been scrubbed for months disgraceful. Wear flip-flops sandals crocks and preferably a gas mask at all times. I had read reviews of rats and cockroaches so was dreading my visit. Luckily I did not come across any but I had my eyes open the whole time and I wouldn't have been surprised if I had. I believe the building also houses permanent residents so expect surly looking old men shuffling around casting evil looks in your direction. The one good point about this place is its location. It's a lovely neighbourhood near great restaurants and bars (Cafe Luxembourg Citrus 'Cesca....etc etc) and only about 15-20 minute walk from Times Square. Close to a subway station (72nd and Broadway) and a quick walk west takes you to a beautiful view of the Hudson. We were unlucky - expedia messed up our booking and we had to be moved last minute. I will be requesting a refund. All that said we had a wonderful trip and the hotel was a minor blip but for the price there are better places to stay. I have been as truthful as possible in this review and would not recommend it to anyone and I hope you have read some of these reviews before booking!,sheissuffering
UR31173731,2009-30-May,THIS PLACE IS REALLY SCUZZY!!!! If you don't mind the LOWEST of CLASS then go ahead this is the place for you. The walls doors and floors are paper thin a piece of cardboard is thicker than the bed pillows were the TV half assed worked there were no utensils to rinse your mouth out with in the crummy (shared) bathroom when brushing your teeth. The rooms are hot no air conditioning the coke machine was broke everything seemed broke (and mind you there is nowhere within a block or two to get a drink) so you better come prepared. This place is old and non-renovated smells bad and reeks of disease. I find it borderline desciptive to run a facility like this to guests from out of town who unknowingly have no clue what this dump is really like until they get there after they've booked and paid (nonrefundable) for 2 3 nights then find out . The front entrance is okay you cannot tell what a dive it is until walking down its hallways. It also bothered me when I saw so many other unhappy guests. If the FDA allows the operation of this hotel then it is only passing standards by the skin of its teeth. The staff must hate their jobs with SO many constant complaints and unhappy guests and I can't even imagine what the owner is like. I was stuck there 3 nights and the thought of returning to the room nauseated me. The ambiance nearly ruined my first time visit to NYC. PAY A LITTLE MORE IT'LL BE WORTH IT. READ OTHER REVIEWS OF OTHER HOTELS WITH BETTER RATINGS. BELIEVE ME NOT ALL PEOPLE WHO'VE RATED THIS HOTEL ARE LYING.,sallyjb88
UR31477937,2009-3-June,The previous reviewer stated that her and some college friends stayed here....well.... if you are more "mature" in your years and have settled for these type of accommodations in the past don't settle for this "dump" now! We have stayed in older hotels in NYC before and the rooms were adequate but this place.... Something should have told me to run when I saw an elderly gentleman shuffling his way through the hallway with a cigarette hanging from his mouth heading to a telephone booth in the hall. When we arrived at our room we said okay let's see what is behind door number 2. Once we opened the door to our surprise we saw our own personal roll of toilet paper resting on a bed with a mattress shaped like a half-moon. Immediately I had a flashback to my days when I was in the military sleep in the "field". There was a small sink tucked in the corner and my wife asked where is the bathroom? Well folks the bathroom is located down the hall and around the corner. You get to SHARE the shower and toilet with the entire floor. Oh and by no means is this an inviting bathroom. If you want to be able to get as good night sleep I would STRONGLY suggest that you stay elsewhere. This review is not a knock on the courteous lady at the counter who greeted us. Phoenix Arizona,BKNYPD
UR50267156,2009-29-November,You know that saying "You get what you pay for?" It's really true here. There's a reason this place is so cheap. I've stayed at hostels that were much nicer. The good: PRICE - you won't find places this close to the action in Manhattan for so little money. LOCATION is great. The neighborhood is beautiful and very quiet - street full of old brownstones. Very safe. The subway is 2 short blocks away at 72nd st. and Amsterdam Ave. There are stores and restaurants nearby although we didn't partake in any of them. Hop on the subway and Times Square is 3 stops away. Central Park is 4 blocks walk. AMMENITIES: wash basin in room (nice for washing hands brushing teeth); Refrigerator was new and worked very well. Sorry - that's it for the "good" stuff. Now on to the bad...... BATHROOMS: Where to start? No heat; bugs; exposed wiring hanging out from walls (up high); cracked tiles; tubs desperately in need of reglazing (cracked porcelain etc.); only the rim of the washbasin for setting your things down (you really have no option but to set your things on the toilet cover or the floor); a couple of hooks for hanging things but they are up very high which is fine if you happen to be tall. The light which stays on 24/7 is behind you when facing the mirror (not great for applying makeup; bring your own mirror). We stayed on the 3rd floor at the back (3A8). There was a bathroom right next to our room. There was another one around the corner from us and another up the corridor toward the elevator. All three were similar to the description above. The one around the corner had a non-flushing toilet. The one up the corridor was tiny and had a nasty drain in the middle of the floor with bugs crawling out of it. We used the one closest to us. The door handle on the door to "our" bathroom was broken. You could pull the handle in/out through the hole. In order to close the door you had to pull the whole thing toward you until the knob couldn't go any further on the outside of the door then you locked the door with a sliding bolt. That worked fine until on the second night somebody else used the bathroom and broke the door handle entirely. We found pieces of it sitting on the floor. Now the only way to close the door was to have somebody push it closed from the outside because the hole for the doorknob was too small to grab onto from inside the room. The doorknob remained broken and on the floor for an entire 24 hour period until we checked out. Also you are given a roll of toilet paper when you check in. You have to remember to bring it with you to the bathroom or just leave it in there (but there is no where to set it near the toilet so you'd have to either balance it on the edge of the tub or set it on the floor). Yuck. The shower worked fine. The water pressure was great and there was plenty of hot water even first thing in the morning. It was a bit squicky standing on the rough surface inside the tub but it's perfectly functional - just cosmetically ugly. THE ROOM: We had a large room with 2 double beds. These had to be the most uncomfortable squeaky beds I've ever slept in and I've travelled extensively. You could hardly breathe without hearing the bed squeak. There were no plastic mattress covers on either of our beds. I did check for bedbugs and found nothing. Each bed had two very flat flimsy pillows. There was a flat sheet on the bottom that needed to be re-tucked often. There is a flat sheet velour blanket and NASTY bedspread on top. I don't know if it was just the design but that thing looked like it hasn't been washed in a couple of decades. We peeled off the bedspread rather than risk touching it. There is a nightstand between the beds with a clock radio a phone and a lamp. I can't comment on the functionality of the clock radio because I unplugged it in order to use the electrical outlet behind the bed for my phone charger. There is an armoire with a TV that works but only gets a few stations like TBS and some local channels but no Weather Channel cable news channels or anything similiarly useful. The TV remote does not work. There are two upholstered swiveling chairs but no table that you could use to eat or set your things on. There is an old cast iron radiator for heat. I could never manage to get the temperature right in our room. The first night the weather was mild outdoors and we roasted in the room. The second and third nights the weather had turned cooler and much windier. We froze. The windows are old and leak lots of air. There is no insulation in the walls. If the forecast for your stay is "cold and windy" bring your flannel pajamas and extra blankets. I slept in my polartec jacket and gloves the last night and was fine then. There are no grounded electrical outlets. There were only two outlets (except for the one that served the refrigerator and the television together) that worked. I brought along a power strip but was unable to use it because it is grounded and wouldn't fit the plug. There is no mirror in the room. There is a closet with one hanger. There are mini-blinds over the windows but no curtains to help keep it warm or dark inside. There is a very tiny waste bin under the sink. The carpeting is fairly industrial looking but seemed clean in our room. The hallways on the other hand were dodgy. There was trash set out - left by guests for pickup by the housekeeping staff and lots of paint flakes and debris. It looked like the corridors hadn't been vacuumed in a while. That's it for the description. We also had one rather strange thing happen while we were there. Our first night was Thanksgiving Eve. We went to bed early because we had to get up early for the parade the next morning. At about 12:30am we were all awakened by the sound of someone walking around in the room above us. That went on for about 30 minutes. Then just after 1am the person started VACUUMING the room. The vacuuming went on for 45 minutes. I am not kidding. I must have checked my clock about 47 times during this ordeal. Finally at 1:52am I decided I had enough and went down to the lobby to complain. The desk attendant told me the room above was vacant that night. I responded by saying "well either you've got the next Texas Chainsaw Massacre going on up there or a vacuuming ghost." He promised to check it out. The vacumming stopped 10 minutes later. We were supposed to be checking out today but we left a day early because we were all cold and miserable and didn't want another night of discomfort.,jonesinmybones
UR50154876,2009-27-November,When I booked the hotel for $85 on Thanksgiving eve I thought it was inexpensive but how bad could it be? Well.. Peeling paint and plaster rotted bathtubs (you can't shower here it's too disgusting) no battery in smoke detector bugs in bathroom no chain lock (missing) paper thin pillows with plastic sheet underneath linen dirty and ripped carpets. Pay the extra money and go elsewhere. Cheap room is not a value.,chaenny
UR28770411,2009-25-April,We were looking for a simple hotel for a week for a reasonable price. For us it was OK that we had to share restroom and shower with other guests on our floor and generally speaking the rooms appeared clean. However we did have a few surprises: The shower closest to our room did not work for a couple of days some guests were loud in the middle of the night we could not control the temperature of our room and one day our room was not serviced. Worse however were the two bed bugs we have found the morning we left whose bites we still felt a week later and how the guy at the reception reacted when I mentioned the bed bugs during check-out: He did not respond at all. Thus I am sure they did not take care of possible additional bugs after we left...,Wilfred95
UR30661201,2009-24-May,the hotel is in need of updating also there is a smell of wee on the ground floor from the last room near the telephones very disgusting. The rooms are too hot and the air con too noisy the bathrooms are dirty and smell very bad also the carpet is very worn and sticky. The bed creeked. the rooms where in need of a clean and a paint. Many older people live here and they leave a smell when they move around to the bathrooms. If you like the above and enjoy the smell of wee then go for it !!!,heidimill
UR30581861,2009-23-May,See...I had to stay in New York for two-three days..and I needed to find accomodation..I searched for a lot of hotels..but none were near this mark..The website and the reviews showed that this place was pretty good and looking at that it seemed that this was a great deal for $100...but the moment i arrived at this hotel..i was in for a shock....It seemed like a place for weirdos and mentals...First thing It took 15 minutes to find the elevator and by the time the smell of that place was already making me faint...when i finally found the elevator...it was even more frightful..the elevator was definitely 40 years old and i just couldnt keep up with the thought of going to the third floor...the third floor had the markings written with a scratching on the wall using a nail...thats how you had to identify it...I was lucky enough though on the attached bathroom stuff...because It was straight opposite to my room.....the 2nd day however...i found shaven hairs on the closet...the 3rd day..the hot water tap was beggining to run loose and looked like breaking off any moment..i tried the other bathrooms..but they were far worse...with a temp of -12c and in danger of steam burns at the same time...it was a nice paradox though...but what one get for a $100 accomodation..I think we need to definitely get what we have paid for and what the hotel promised to do.....,siddharthnaidu
UR28402255,2009-20-April,The location on 71st Street West is great. It's only a 2 minute walk to the subway and you can coast all the way to mid- and down-town. The area is residential and quiet so you don't have honking cars loud traffic or throngs of people and the west riverside front is nice to see. We booked 1 room with 2 twin beds. The man on the front desk gave us a choice of the 2nd or 7th floor. I asked which was was better and he said the 2nd floor hallway had a funny smell. The 7th floor was a [--] to get to because of the slow old-school elevator. The room was relatively clean. There were no bed bugs but I did see 1 or two imbedded stains on the clean towels and a random hair on the sheet that seemed to have been knotted during the laundry process. The room included a tiny fridge and a tv. The fridge worked but I don't know about the TV since I didn't turn it on. It had a windw AC and heating unit. The room also came with two large towels 1 hand towel and 1 roll of bathroom tissue for each guest. The bathroom was disgusting. I don't think the cleaners cleaned it more than 1 every other day. I couldn't tell. It just wasn't clean. I hated it and felt diseased when I left. Nasties included skid marks on the toilet crusties on the bath tub and shower installs soap residue on the holders snot or something on the sing bowl. Very icky. The floor was also brown/black with dirt.,YoBrown
UR45693960,2009-2-October,They should pay you for staying there. My first impression was that they didn't change anything there for 40 years. They have shared bathroom not very clean. Room is very small. There are holes in stained sheets. Naked bulbs. No internet access. Tv has a 5 channels all of them has some disturbance so you can't really watch it. And I found two mouses in my room and insects. I received 10% discount from the manager.,pinang
UR48355718,2009-2-November,I cannot review the quality of the hotel but simply my experience dealing with them. I decided to make a last minute trip to NYC this weekend and got a red eye friday night flight with a sunday return. I booked the hotel and purchased theater tickets. Unfortunately my flight got cancelled due to plane malfunctions and the next flight was not till Sunday. Since it was just a weekend trip that was not an option. Despite an official policy that says no refunds ALL three of the theater tickets were refunded as they understood my situation and that it was out of my control. Hotel Riverside Studios however refused to refund me. I called them immediately (Friday night) to tell them I would not be able to make it because my flight had been cancelled. They cancelled the booking but said they could not issue a refund without approval from the hotel manager. For the record I had to call the hotel five times over three days before the manager was there and could deny my refund. Everytime I was told to call back at another time and he would then be there. He never was. So apparently the hotel manager is NEVER there. Furthermore I can understand them perhaps not refunding me if the room was left vacant but I decided to check and so I called their reservations number on Saturday afternoon (I was supposed to stay there just Saturday night) to inquire about the availability of a private room (which my booking was) and was told that they had no availability. So effectively they rebooked my room but still would not refund me. I understand their policies but since it was easy to verify my flight had been cancelled and they managed to rebook the room I do not understand why they could not refund me (as everyone else had done DESPITE their policies). The hotel may be a great place to stay but I can guarantee I will never book a room there again. Judging by the way I was treated hospitality is clearly not their forte.,tatanaz
UR38154089,2009-19-August,I should have listened to reviews it was the cheapest "hotel" so I guess I should have expected it. The girl that checked me in was very rude and dismissive there were mice in the hall disgusting! I was told they couldn't do anything until the morning thankfully I'm not squemish about mice but it was still disgusting! Narrow dirty hallways too. They wouldn't even post a letter for me!,travelman99ie
UR42639896,2009-18-September,It looked loke sometihng you can see in a horror movie. We have seen it all: Ants mice and cockroaches. The location is great but the house is crap. The standard is awful and bathrooms/toilets are crappy. Owners would need to invest in it properly. I am happy we managed to keep our stuff as the room keys looked like something we used 30-40 years ago. I am going to upload a video of the place on youtube soon so search for it.,Sakala
