review_id,date,content,author
UR36603668,2009-3-August,I stayed at the Royal Scot a couple of years ago whereby I got a deal for 29 a night and it was fabulous. Clean basic fresh rooms but 2 years on .... My motto is "you get what you pay for".... well I certainly did this time. I paid 34 for a twin room (which I got) for an overnight stay en-route to Belgium near St Pancras Station. The bed was comfy the linen clean and the towels but the carpet needed a good hoover some kid had black hands and put hand prints on the walls near the tv. The tv did not work did not even switch on. The skirting boards were 2 inch thick in dust they had not seen a clean in months. The bathroom just passed for cleanliness. Disappointed. I use Travelodges alot and will not use this one again in London. Should have stopped at the Premier Inn just over the road from Kings Cross that had good reviews and would have been worth the extra 30 or so quid to 'kip in a clean room'. Most disappointed!,LadyWard1
UR50271050,2009-29-November,This hotel has the rudest person in a customer service based job that I have ever had the misfortune to encounter. She lied she accused me of lying she was obnoxious and completely incapable of working in a hotel reception. No people skills and quite clearly no ability to deal with a genuine complaint. In our brief time at the hotel I hoverheard 4 seperate people making complaints about the facilities. We had booked 3 double rooms for a family break as we were travelling seperately the others in the party arrived before my partner and I and had booked in. When we arrived we were told by the 'receptionist' that they did not have any double rooms left and that we would be in a tripple she said that if we came down before 12pm the follwing day we could change our room to a double we reluctantly accepted this and made our way to the tripple room. The room was not what we would have expected from a travelodge (see photos). The bathroom was dirty and had dirty towels that had not been removed there was a hole in the bathrooms door the grout around the bath and sink was grubby there was dry rot in the skirting and a disgusting brown build up of something unidentified around the join between the toilet and tiles we had no soap the plastic disposable cups had clearly been used by the guests before us (toothpaste stains etc) The dressing table/desk had no chair there were what looked like brown liquid stains all over the walls from top to bottom (god knows what happened in that room?!?!) there were what looked like either vomit or hot chocolate stains down the side of the tv unit and finaly there was mould around the window. DISGUSTING. AVOID AT ALL COSTS. THE PHOTOS POSTED BY OTHER REVIEWERS ARE NOT REPRESENTATIVE OF ALL THE ROOMS IN THE HOTEL. ONLY SOME OF THE FLOORS HAVE RENOVATED ROOMS. As suggested the night before we went to reception to ask for our room to be changed The receptionsist (a different one) said that this was fine and told us to pack our bags in preparation for the move. We were told to come back in the afternoon and our double room would be ready. When we returned the original rude receptionist was back on duty- to cut a very long story short - our double room was not available she denied that the person we spoke to in the morning even existed then when countered about it she said the woman didn't work there!!!! She denied that she had told us when we checked in that we could swap rooms and basically accused me of lying and making it all up. The hotel was overbooked so our option was to stay in the room we had or to find another hotel. It appeared to be ok for the hotel to give someone else the double room we had booked and paid for before arrival but she refised point blank to give us a double room that someone else had not yet booked into even although it meant splitting up a party of 6 . In the end two of us had to move to another hotel. She arranged for us to be picked up by taxi and moved to another travelodge. As it turned out the taxi was unmarked and the driver dropped us off 10mins away from the travelodge. We had no idea where we were going and had to hail a black cab to take us there. When we got to the second hotel they had no record of us being moved! We had to wait an hour before the deputy manager was able to give us a room. He had to sort out the mess. I am not fussy I expect a room of the standard that is being paid for we paid 59 per night (room only) cheap by London standards. I was not expecting a palace but I was expecting to get a double room get a clean room and have staff treat me with a bit of respect and dignity as a paying customer.,LozHammersbaws
UR28915822,2009-28-April,I have stayed in some decent Travelodges but this one was shabby run down and dirty. Noisy rooms and constantly full of noisy school trips who block entrances and lift access. No better than a hostel. We had a triple bedded small room which didn't have enough space for any chair or bedside table. No phone. Broken toilet roll holder. Air conditioning didn't work. Not a good experience and we didn't stay the full length of our booking..,Darlo_ManUK
UR33290457,2009-27-June,I booked this hotel as my husband and I had an early Eurostar train to catch the next day. We arrived at 1pm with our heavy backpacks hoping out room would be ready (it was a business day - usually people check out early so rooms would be available). We were told that we would need to pay 10 more to check in 2 hours early. The room was sitting waiting and we have to pay extra? (That option was not there when we booked the room months ago!). There was nowhere to leave luggage so as we refused to pay we had to take them with us. (BTW Kings Cross charge 8 per item so if they point you in that direction I wouldn't bother). We arrived back later having done what we needed to in the day and checked in. We asked for a quiet room so were given one facing the back street. It was noisy but with the windows closed it was ok to sleep just with no air con it was very very hot! The bed seemed comfortable and pillows ok. Ensuite you could barely stand in they are so tiny. Shower was ok and powerful enough. We had to be up at 6 so we tried to have an early night and were suprised that the hotel seemed quiet at 11 at night.....we thought we were going to be lucky. But no come midnight the loud party-goers returned to the hotel (bearing in mind we stayed on a Tuesday night we were not expecting much loud behaviour!). Instead of returning quietly and going to their rooms they were talking loudly and shouting down the hallways and slamming their doors. This continued as each room returned until gone 3 in the morning - that was 3 hours lost sleep. The walls to the room seem paper-thin also. I could hear people talking in their rooms who were two rooms away! I could also hear the people in the next room (who seemed to be quiet and like us trying to get rest) use the toilet.... lovely! We finally got some sleep and were woken up at 5.30 with the first person leaving - and slamming their doors (probably in protest of the inconsidereate people who returned late and made as much noise as they could). The location is fine 5-10 mins walk from Kings Cross - though the street is absolutely fine in the day - not sure I would want to walk it in the dark evenings in winter.... All in all I would spend a little more and stay somewhere nicer. Book early and get a decent hotel if you need to rest as its a complete waste of money staying here..... not to mention stressful!,GBland
UR33217491,2009-26-June,This was the only hotel I could get in this area for less than 100 a night which was pretty much my budget for a one-night stay. I arrived initially at the hotel in between meetings and was told you can't check in until 3pm otherwise you have to pay an additional 10. I didn't really want to pay any more - not sure why when your room is ready you can't just check-in. There was also no space to leave luggage at reception so had to lug it all around with me to my meetings all afternoon until I could go back. When I did eventually check-in the reception staff were quick efficient friendly and helpful which did calm my mood slightly! My room faced over the back of the hotel which overlooked other guest rooms. There are no privacy curtains so you have to hide in your room to get changed or get dressed in the dark (you could of course turn the lights on and shut the curtains but pretty sad on a bright sunny day!) The room was clean and tidy and a good size however the bed was shocking!!! It was so soft it felt like it collapsed beneath me when I sat down and I'm only 9st! Not a very good night's sleep. Also be careful when leaving your room - as other reviewers have pointed out you have to slam the door to make it shut properly. I tried to be quiet and close the door softly but it didn't lock!! Lucky I checked it otherwise I would have been away all evening with an open door!! The main positive is location - just 5-10 minute walk to Kings Cross station so easy to get around London and onto mainline trains. Don't think I would choose this hotel again - would try a nicer hotel instead if I can get a better price. In all fairness the price I paid was 79 but once you add breakfast (about 6) Wi-Fi access at 10 for 24 hours and early/flexible check-in at 10 you might as well stay at a better hotel which has these things as standard.,Jenny077
UR30725529,2009-25-May,Me and a friend stayed at this hotel as a treat after a night out in London. We checked in quite late and they had no room for us or another up to 20 people. After a 3 hour wait we were shown to a room. We stay in hotels quite often and the test is to have a check of the shower and the toilet. This we did and they were both disgisting there was also a smear just above the bed which looked brown and I shudder to think what it was! We compalined and then after another 2 hour wait we were shown to a replacement room. By this time we were so tired and so decided to stay anhd not even look at the toilet! We went to bed and we both felt things crawling on us I got up and went into the bathroom I saw visable bugs as big as my small finger nail crawling all over me I had risen bites everywhere too. I ran down to the reception area in my underwear to show them and they were so shocked and offered me a doctor. I have uploaded some pictures of the bites of 3 days later... they should be shut down disgusting I could have caught anything!!,Dont-trip-up
UR49589347,2009-19-November,The single beds in this place are no wider than 2 and a 1/2 foot the mattress is made out of what felt like 3 blankets layered on top of each other. The staff are pathetic they didnt have a clue about anything. The noise from outside traffic was unbearable too. They charge 1.00 for 20 minutes of internet. Rip off. The bathroom was built for the Hobbits come to think about it so was the bloody bed. Avoid. Avoid. Avoid. Avoid. Avoid. Avoid.,MusicMan54
UR24715335,2009-18-February,Booked late and wouldnt normally use TL but it was convenient to our visit. Wallpaper torn lights wonky showing wiring dirty rads others hair in the bath!!! Disgusting. It was quiet well situated and slept ok. The auto main doors to TL wouldnt close so breakfasted in coats as it was so cold. Wont be back to that or any other TL!,TopseyWiltshire
UR47091532,2009-17-October,Stayed at the Travel Lodge Royal Scots on the 9th October for 2 nights with my husband brother and sister-in-law.... Hotel is not the best looking Hotel and looks rather dingy..a bit grubby in the lobby and not very well lit. Check in was quick and after being directed to our rooms we went for the lift ( no stairs) 2 lifts ( 3rd one out of order)that need to be up dated our room was on the 2nd floor but after getting out of the lift and following directions we ended up in what only can be described as the basement.... however even though on street level there was no noise. The bedroom was small but the bed and bedding were spotless the bathroom was in need of up dating even a bit of grout in the tiles would of made a difference on the whole not a bad place to stay would stay again..... its not 3* as described for value its o.k ...easy to get to the tube and taxi's are just as cheap to travel by  the tube to the west end would cost 4 of us 16 it only cost us 8 in a taxi....,bb1Liverpool
UR30099171,2009-16-May,The rooms are small compared to other Travelodges it's not very clean and needs decorating. It's very noisy people in the corridor sound like they're in your room and all of the doors require to be slammed to be closed causing more noise. Spend a little more and stay somewhere else.,Cumbrians_7
UR51271406,2009-15-December,This hotel needs a complete rebfurb. Its old tired dirty. The decor in the room left a lot to be desired. The lamps was falling off the wall the paint was peeling. It looked as if the skirting board had been hit with a Hoover and had a bit chunk out of it. The bathroom was tiny but actually quite clean. The bed had the thinnest duvet on it. The staff was completely unhelpful. I had no phone in the room so had to go back to reception to ask for an iron/ironing board and was informed they had non available but might have some back in 1/2 hour - I asked if I could put my name down for one and was told no it was on a first come first served basis. 65 for a double room is a disgusting price for a shabby hotel like this - and no breakfast either - wish I had stayed somewhere else - definitely would not go back,sazbox
UR37770360,2009-15-August,I phoned travelodge to book a cheap overnight stay whilst visiting London to see Oliver in the West End. The location of the hotel suited our needs well as it was only a 20 minute walk to the theatre and as we were watching the midday performance we felt it was easy to walk there and back. The room was disappointing as I have stayed in Travelodge's before and always been satisfied. As mentioned most of the staff were foreign and this gave the impression of rudeness due to the lack of understanding. Our room was very cramped and the twin beds might as well have been a double as the beds were so close together. My bed felt like it was going to collapse each time I rolled over. The day we stayed was a hot day and the ventillation in the room was awful due to the fact that the window would only open about 2 inches. The worst was the doors to the rooms as you had to slam them to shut them even if you tried to shut them quietly they banged. I was kept awake for a lot of the night by the doors banging in the corridor and the air conditioning unit for the cafe/bar. I'd recommend this to someone who wanted to have a cheap stay in London with a good location but would warn them not to expect much. Be warned that the hotel is just inside the congestion charging zone and to use the hotels small dingy carpark you have to drive about 3 metres into the zone which means you have to pay the charge or be stumped with a heavy fine.,tree9_99
UR23460533,2009-11-January,Would not stay there again. Far from city center and attractions. Very small rooms clogged and dirty bathrooms. Poor service. Good breakfast. Try to avoid this hotel.,SanJuanInbox
UR46458446,2009-10-October,Title says it all do not stay here! Dirty smelly and staff couldn't care less.,Elvisthegrey
UR20694551,2008-7-October,Stayed in this hotel for one night before using eurostar. Let me start with the good points: Location Now for the stuff that was not so good: Couldnt sleep due to constant trains noise throughout the night (to be fair they did have a warning on the website) but the noise was tremendously loud. The room was small dirty and dated. The window was single glazed and had no curtains which made the room really cold and the electric radiator was useless. The bathroom was small filthy and very basic. i.e no shampoo's etc. Considering we paid 87 for one night that is not value for money. They provided two small hand towels in the bathroom in a double room. it was like trying to get dry with a napkin. This is the worst excuse for a hotel i have ever witnessed in my life and had i been staying for longer i would have complained or simple found somewhere else to stay.,Namsey
UR17608378,2008-7-July,My husband and I stayed for one night before getting the Eurostar the next morning. All I can say the place was dirty. The lift doors looked they had been cleaned with dirty water. The bar area looked shabby and there was no way I was eating there. Our room was so tiny I kept tripping over things as there wasn't enough room to walk. Room was shabby and wanted a good clean. Wouldn't stay there if I was being paid to.,SkegnessSeashell
UR22466848,2008-5-December,Like another writer we booked a Travelodge because we thought you knew what you were going to get when you did so - simple but adequate bedrooms meticulous cleanliness and a good breakfast on site or next door. Our room was a nice one - but the heater was broken and the secondary glazing wouldn't stay shut letting in a lot of street noise and cool air. The bathroom basin was cracked too. But the public parts of the hotel were what disappointed - inadequate lifts in shabby condition (with 2 out of the 3 out of order during most of our stay); a cold lobby totally inadequate for the number of people who gathered there - it was often jammed with queues from coach parties. (The automatic doors to the street seemed to jam on Open.) Totally inadequate breakfast accommodation which was caused long queues to form in the cold lobby and caused you to have to search for empty chairs and carry them to your table. Be warned - this is not the right hotel if you are looking for a restful haven from the hustle of a weekend in London or a place to get a bit of work done between appointments. A large part of the clientele was made of coach parties of noisy - though not in our experience rowdy - crowds of teenagers. To repeat the room was basically OK and the food provided for breakfast was OK too - but it just wasn't what you'd expect from a Travelodge.,R0ckw00d
UR18654464,2008-5-August,if your young i do not reccomend this hotel. i had paid online for a room and went to check inn and was straightaway accused of fraud. i was being shouted and sworn at front of his other colleauges by the deputy manager then took my bank card to the staff room and checked by contacting the bank and found out it was not fraud and that it really was my card. he then came back to me and gave the card and did not even aplogise. i then asked him what happened he then replied 'come out i'l sort you out' he was threatening to fight me. his colleage then refused to let me use their phone to call the police. i was absoultley disgusted of the way i was being treated.,anoyn
UR19777481,2008-4-September,Like a few others we found the wrong Travelodge in King's Cross first. We were directed to the correct property. When we arrived the lobby was a madhouse. I think a tour bus had just arrived. Check in seemed very chaotic. We were assigned a two twin bed room and requested a double. Unfortunately we were denied. Since it was just one night we decided not to fight it. The room was located on the second floor and directly above a dumpster in the alley behind. There were two old and broken air conditioning units in the room. We knew the hotel didn't have air conditioning but were suprised to see these old broken units. There was no phone or clock in the room. There was a small 13" TV that was supposed to have a clock/alarm feature that didn't work. The bed linens seemed clean. The window opened both at the top and bottom but didn't close completely. Overall the room was very run down and seemed quite dingy. There were three elevators that held two people and luggage comfortably but they were extremely slow. In the morning as people started walking through the hallway the door on the room rattled every time someone walked by. There is a restaurant/bar in the lobby but we did not eat there. For the price in London it was to be expected but if given the choice I would not stay here again.,seedergirl
UR16509353,2008-30-May,Found a great offer on a triple room on the travelodge website and i can see why it's so cheap. Pros: 1) 10 minute walk to Kings Cross underground/St Pancras. 2) the bar looked impressive although i admit i didn't use it. Cons: 1) reception refused to let us leave our bags behind the desk in the morning so we had to carry them round all day (3pm earliest checkin) 2) the elevators and corridor walls are disgusting. 3) the walls in our very small room were dirty. 4) the toilet roll holder had been ripped off the toilet was dirty and the shower head was diconnected. for the price and the fact it was just a bed to sleep on i suppose this did the trick anything else and avoid at all costs,ricomc
UR13946746,2008-29-February,Terrible Hotel rooms were small and clean but noisy. First room we had had a screeching pipe noise every 10 minutes next room on fifth floor was even worse - dirty undecorated - the entire floor looked like it was a completly different hotel that Travel Lodge had forgot about! Final room we had was on third floor better but again small grubby and so noisey really lound doors banging pipes creaking and even the lift made a nosie. Staff were helpful but would not recommend this even for 30 per night!!!,JPG074
UR23085064,2008-29-December,We booked this travelodge as an overnight stay so that we could see the lights for Christmas. We paid 19 per triple room per night. We got what we paid for - basic accommodation in quite a central location. The triple rooms are tiny and not really suitable to accomodate three beds - dread to think how packed it would be with three adults. The decor was very run down the sink had a massive crack in it. Overall very run down. But it was 19 per night it was cleanish the bed was very narrow but fairly comfortable. Wouldn't chose to stay there again wouldn't recommend it and was quite disappointed that it was part of the Travelodge chain. Luckily our kids didn't notice any of this and still had a lovely time in London - so there you go!,travellingmumof3
UR13042167,2008-27-January,This hotel is appalling - do not stay! We were here for one night 3 of us and we had a triple roon. The space between each bed was less than 50cm. There was no room and we were stumbling over each other. The bathroom was horrendous im not a snob in the slightest but when it comes to a hotel i expect decent basics - a clean bed (mine was damp) a decent sized bathroom (this bathroom was so small the door only opened 90 degrees) and good service. We were greeted by a very unhelpful receptionist who couldnt find our booking by our names made me pay 1 to use the internet and then found it under our address. The lifts were fulll of someones take-out wrappings our room ont eh 4th floor was right next to a swing door which was constantly being swung open - you could get no sleep! I paid 2 for a coffee fromt he machine in the reception for there to be no cups in the dispenser. I told the staff receptiionist about this who offered me a watered down coffee from the bar - no refund!! I would not recommend travelodge at all!,pickytravelbags
UR15408015,2008-27-April,i have just returned from a university reunion in London staying just the one night in this hotel as we couldnt get into the kings cross station travelodge. We had 2 triple rooms booked on the 4th floor. 3 of us went to check into our room on one side of the floor and the others on the otherside. To our dismay the room i had the key card to had been occupied and i walked straight in on someone elses room! we then went to find our friends to find they had the same problem however the young lady that was staying in that room on her own came back to the room to find 3 of them sitting on her bed. She was mortified to think that all her stuff was in there and we had a room key! we all went to recepetion to complain to a very un appologetic receptionist. From then on we were worried about the safety of our belongings and on tenderhooks thinking some stranger could walk in on us at anytime! The room was less than basic very cramped strange smell only 2 towels even though its a triple room one very flat pillow each and not even a chair i thought that was standard even for Travelodge's! In the morning checkout was not till 12 noon so we took advantage and tried to have a lie in to only be disturbed twice by to maids trying to clean our room surely they know if we have checked out or not! From about 8am in the morning all you can hear are the awful heavy doors banging from below and above and making the room just shake! All in all i know they are budget hotels but this one is well below travelodge standards and needs some serious attention dont bother staying there!,Extremelyhonest
UR14497970,2008-24-March,I was unable to book the other Travelodge in Kings Cross so booked this place instead. The Royal Scot has always had a bad reputation but I assumed that it had been upgraded was I wrong! It is a total disgrace I didn;t even have a chair in the room or a plug in the snk! The carpet was torn and frayed and the furniture was at least 30 years old. I paid 81 and would have been better off booking a cheap hotel in the streets off Kings Cross. I am amazed that anyone can say they had a good time.,colmil
