review_id,date,content,author
UR3539199,2005-8-June,I approached this hotel with trepidation as I had not told my husband about all the negative reviews - but it was so cheap for the location and we were only staying a couple of nights. We arrived by car and first impressions were awful as the staff on reception were unbelievably rude very unhelpful about parking the car and refused to check me in as I did not have the passports available. By the time we had sorted out the car and the passports the rooms we had booked were taken. (We were 2 adults and 4 children). We were then given a key to an enormous apartment on the 17th floor entrance hall huge lounge/dining room 2 very large en-suite bedrooms. Sure it was old and shabby but very clean and fantastic views! My previous experience of New York hotel rooms is that they are no bigger than cupboards so boy weren't the kids impressed! So all was forgiven. But why oh why do they have to be so rude?,dragonannie
UR2990003,2005-8-January,We arrived on the 30th of December and I for one was expecting something combining fawlty towers and say the darkest depths of hell! Apart from a chunk of the doorframe to the bathroom being missing and a shower that flooded the floor everytime you washed it was alright. We would have had a nice view of nyc but it looked like the windows had been cleaned sometime during the 1950's! The room was clean tidy and the shower was hot. Overall the hotel needs some serious work but who cares when you're in new york!,A TripAdvisor Member
UR3646805,2005-7-July,Don't be deceived by the elegant lobby which greets you at this hotel - the checkin desk is badly understaffed and during busy times you can expect to be waiting several hours to get your key. Taking the elevator up to our floor (7th) I immediately got a bad feeling. The carpets were worn and threadbare the corridor smelled like an old hospital paint and wallpaper was peeling off everywhere and the place had a generally decrepit feel to it. When we got to our room we found that there was no fridge a terrible musty smell in the room and the carpet under the beds strewn with old rubbish and mouldy potato chips. The air conditioner was faulty and had leaked all over the carpet creating potentially disease-spreading damp spots. Electrical points hung off the wall. Wallpaper peeled everywhere and the ceiling was full of painted-over cracks. The bathroom was clean but basic however the sink leaked where it had been badly cracked (looked like it could collapse at any time) and disastrously it was not possible to open the bathroom from the inside due to the handle being broken which caused my companion to get trapped in there until one of us returned to the room causing all kinds of panic. The beds were single beds rather than double beds for people used to the extra space. Room service were not at all helpful and had a "life's tough" attitude to our predicament. I got the impression they were more than used to complaints. Their website says the hotel was recently refurbished but I checked out three of the floors at random and could see no evidence of any such refurbishing. Not only is the hotel unpleasant but it could be a health hazard. Poorly fitted or broken electrical fittings/appliances are undoubtedly unsafe; damp carpets and poor cleanliness spread disease and any restaurant would immediately be shut down if these conditions were found - I find it hard to believe that it is legal to maintain hotel rooms in this fashion. The hotel rates were around $170 - $190 per night and while I was not expecting luxury I was at least expecting clean and functional. Fortunately we were able to contact our travel agent cancel our booking for a refund and move to the infinitely superior Hotel Belvedere near Times Square an excellent and well maintained hotel at slightly more expensive rates. Hard to believe that this hotel manages to stay in business - it is the worst I have ever encountered in my life and far short of what I would expect for New York City.,A TripAdvisor Member
UR3342766,2005-7-April,You may go there but do not wish all expect the location and the access. It is true that all of the rooms are not clean. It does not matterbecause I only sleep and take a shower in the hotel. All of my important time was spent outside. If you would stay a cheep hotel which has a bath I recommend there. You may be able to get a room under $100 per day in Net. Do your best!,A TripAdvisor Member
UR3644342,2005-6-July,This is the worst hotel on the planet! Do not stay here! We were warned by a couple from England. We did not think that it would be that bad. The lobby is beautiful. However we stayed in room 200 and our room looked worse than any pictures on this website. It stunk! The beds were like brick. There was not an alarm clock. There was a film in the bathtub. The phone was an old push button kind. There was not even a signal for my cell phone. I was so scared to stay there. I went down to the lobby and demanded my money back. Grey Line Tours still has not refunded me. Please do not stay here! It is the worst hotel on the planet.,A TripAdvisor Member
UR3993420,2005-5-October,I could not recommend this hotel to anyone. At first sight the lobby looks fine quite busy staff not too friendly but have a lot to deal with. Location is just about all this hotel has going for it. The hall was filthy dirty the doors of every room were marked and dirty. The room itself was quite large with two double beds but this was not really an advantage as it just gave more space to see the peeling paint mould on the walls stains on the carpets. This would almost be bearable if you had paid relatively little for the accommodation but at $250+ per night this hotel was utterly disgusting. The next two nights we went to stay in the Comfort Inn on W36th and the difference was unbelievable. The hotel didn't look like much from the outside but inside it was spotlessly clean and comfortable with breakfast included in the price.,A TripAdvisor Member
UR2977367,2005-5-January,Hooker in next room wins Oscar. Hotel was dirty scary and crumbling. The lock on my door did not work. I prayed my floor did not fall through. Shower was dirty and bathroom littered with trash. Furniture broken and very old. Remote for TV was under bed and boy am I sorry I looked under there! Flea bag! Don't let the lobby fool you.,A TripAdvisor Member
UR3992378,2005-4-October,We stayed at this hotel as a treat for our 25 wedding anniversary. We were very very disappointed indeed. The previous pictures are accurate. the hotel corridors are dirty shabby in desperate need of refurbishment. The rooms were exactly the same the maid certainly didn't get a tip. The foyer was lovely except we should have noticed that all the plants and anything over 7 ft high were covered in deep dust. Do not go to this hotel  when we complained there was no reaction at all. Birmingham England,A TripAdvisor Member
UR2975790,2005-4-January,Just spent 4 nights in this hotel. the room when we arrived was very dirtyI went down to receptionafter a long wait I spoke to manager I was told it was the only room they had 690. I was told to speek to housekeeping this I did. When we returned later the room was just as dirty. It was like this the whole holiday. I took about 10 photos of the dirt.eg. stains on carpet black mould on three legged fridge also bathroom wall. Thick dust on skirting boards broken toilet flusher also table drawer missing. It was the dirtiest hotel we have ever stayed in,A TripAdvisor Member
UR3162019,2005-4-February,"You get what you pay for". Hotel Penn is loud dark & dirty. The sheets are scratchy and coarse. The characters roaming the hallway are suspicious. I had a general feeling of being unsafe in the hallways and elevators in daylight! The only upside is the central location directly across from Penn Station. Staying here made the difference between an unpleasant and enjoyable stay. I stayed 2 days for a meeting- d/n get a fax sent to me nobody knew where our meeting room was located internet access down. Scores of fellow employees complaining. Spend the extra $50/night to stay elsewhere. You'll be glad you did!!!!!,MGPNewport_RI
UR4075939,2005-31-October,We booked our room online and were obviously fooled by the photos from the website. The lobby is not a good indication of what kind of room you will be getting! Once you leave the lobby and get off the elevator at your floor you will step into a horror film. The carpets are dirty and coming apart and are taped down with duct tape in places. The walls are filthy and the doors to the rooms are the strangest things I have ever seen in a hotel....and they are all stained and crumbling. And all this is before you set foot in your room! When me and my wife set foot in our room we both almost burst out crying..it was so bad. We didn't expect any luxury for what we were paying but what we did expect was at least a clean place to lay our heads at night. This was NOT that place. The "double" bed was tiny delapidated and the mattress was worryingly stained. The bed linen was awful with a heavy itchy old blanket on top. The room itself was shocking...paint was peeling everywhere...the walls doors and carpet had stains all over them. The A/C was busted. The bathroom was actually not bad in comparison althougth I must say I tended to squint a bit when I was in there so I didn't spot anything that might have freaked me out. They were very random with the clean towels...some days we got some some days we got none. It was a good job we were to spend minimal time in our room...we got up early and stayed out very late most days just so we could be away from the place...so much for a nice relaxing lazy weekend in New York! There were always long lines at the front desk and check in seemed to take forever. The staff were kind of unfriendly as if they were doing us a favour by checking us in at all. I'm glad we only stayed here for a weekend because I couldn't imagine being there any longer than that. Anyone that goes back to stay here after one visit much be a masochist! I would never stay here again...and would definitley advise anyone I cared about NOT to stay here. Do not be fooled by the online photos or the location spend a bit extra money and go and stay somewhere else. This is what we will do next time. This place is daylight robbery and I'm surprised that people can get away with running such a dump of a hotel in this day and age.,RChappo
UR4153614,2005-30-November,We stayed at the Pensylvania Hotel Nov 2005 when we arrived at the hotel we walked into the foyer and thought WOW we have done good for our money however the rooms are very shabby basically clean but wouldn't go so far as to sway clean. The best thing about this hotel is its cheap and a location to dream about.,macca1Uk
UR3840735,2005-3-September,Seen conflicting reviews on this board and am glad that I had my camera. The room was dirty the carpet stained and filthy the door frame rotted as you can see in the pics and the service poor at best. Not recommended at any price I felt icky the whole time I was in the room and did not go barefoot on the carpet,A TripAdvisor Member
UR3632761,2005-3-July,I stayed here for 3 nights in June and was amazed at how disorganised things were... It took 45minutes to check in and the queue behind us was growing. A great first impression! When we got to our floor my heart sank as I saw the state of the corridors and doors (very grimey). We entered the room to find the bathroom whilst broadly clean had been fitted decades ago. The rest of the room was reasonable but lacked maintenance and genuine cleanliness. In summary the location was fantastic the lobby looked good the room had just about been kept clean but I would NOT recomend this hotel.,The_Hickster
UR4159348,2005-3-December,Room 697 has NO heating and although the outside temperature was below freezing a call to the maintenance engineer produced no action! Reception and Left Luggage staff were very helpful and friendly and the position of this hotel is superb - in the centre of EVERYTHING and one block from Macey's! Room equipped with hair dryer (we used ours as a rather ineffective mini fan heater!) ironing board and iron plenty of clean towels bed linen changed etc. - but a drink-making facility would have been welcome. A cavernously-huge hotel famous in the 20s 30s 40s but long overdue for a refurbishment. For a short stay in the centre of NY when time is important it's OK but if visiting in the winter - check the heating in the room is working!!,mau083
UR3721215,2005-29-July,Before I had read any reviews about this hotel I booked it online at Expedia because of the great price and location. About a week before our trip I came upon this website and decided to read the reviews about Hotel Penn. Lets just say after reading all the reviews and maybe seeing only 1 good one I was not very excited about our familys first trip to NYC. Since we couldn't get a refund my husband and I decided to go for it and if it was really that bad we would try and find somewhere else to go at last minute. We got to the hotel with our two small girls ages 3 and 9 at around 3 in the afternoon. There was no line for checkin so we got our room very quickly. I asked the woman who gave us the room for the doublebeds and she said fine. They put us on the 7th floor in room 747 and as expected when we got out of the elevator it smelled terrible and was basically a whole in the wall place ( litterly) We opened the door and we didnt even go inside all the way before we decided to switch rooms. We called the front desk but no answer so I hung up. My husband called the operator and we got a answer and we had to make up a problem so we could switch rooms. My husband being a doctor told the woman that our two daughters had asthma ( wich they dont) and were coughing and sneezing from all the mold and dust. I guess they were afraid of a lawsuit because they called us back in 5 minutes and told us that they had a room for us on the 16th floor. We went up there and the man was very nice and apologized over and over again for the other room. The new room was very spacious had a tv 2 queen size beds a large bathroom and a desk along with a cot. The man told us that this room was a superior upgrade and was usually reserved for Hotel Penn members but he felt bad and decided to give it to us for free of upgrade charge. He even told us to go down to the front desk and recieve the citypass books that he reserved for us. We stayed for 5 nights and after the second night we sort of got used to it. Although the blinds broke on the windows and there was pubic hair all over the bathroom from guest before us the maids brought fresh towels everyday and were very understanding when my 3 yr old had a accident in the cot and brought us fresh sheets right away. It was a great location but the resteraunt Lindys was not good at all. the food was dry and overcooked. We walked everywhere and never took a cab except to the airport and we easily walked to Times Square withing 10 minutes depending on traffic. I dont think we will stay there again but Im glad we gave it a chance,A TripAdvisor Member
UR3813575,2005-29-August,First the good news - location is fine. Now the rest - the lobby was probably impressive when the hotel was built but it is now forbidding and a bit grim. This is nothing to the corridors which were disgustingly dirty and unkempt. I went with friends and we tried to jolly ourselves up on our way to our rooms; these were awful (3 rooms) all dirty with 'interesting' stains in a variety of places (carpets walls - someone had obviously had something on their hands some time ago and had wiped it on the walls never to be cleaned off!). Bathroom so old that the bath enamel was peeling. Many months of dirt/hairs/stuff at edges of floor. A chambermaid came in every day and changed the sheets and cleaned the bathroom but nothing else. No vacuuming dusting or anything that needed doing. Poor woman was obviously just doing what she was told as all rooms were the same although on different floors. The electricity looked pretty lethal. Straight away we all asked for another room (I was happy to have thrown money at the problem and paid extra) but nothing doing there was nothing else and the staff couldn't have cared less. Don't go - pay more and go somewhere else.,A TripAdvisor Member
UR3426329,2005-29-April,This place deserves no stars but that's not an option sadly. This hotel is the worst piece of garbage ever constructed. All this talk of "you're going to be in the city; how much time are you going to spend in your hotel?" is absurd. If you're going to spend the whole day walking around NYC you need a decent place to sleep or you're going to get progressively more sore and tired as the days pass. You are not going to get a decent night's sleep at the Hotel Pennsylvania AKA The World's Worst Hotel. The beds are not just bad they are substandard. Are you comfortable sleeping on a slab of concrete covered by a sheet? Then book away. Do you enjoy sleeping in a room with a door and walls so thin you can hear everything that goes on on your floor? Then this is the place! Do you enjoy rude front desk employees peeling paint stained carpet and bedding and pipes that make noise? Then you've found your hotel. If you don't enjoy any of these things then please for the love of everything stay somewhere else. Anywhere else. I seriously had a better night's sleep the last time I slept outside for concert tickets.,A TripAdvisor Member
UR3506149,2005-28-May,Upon arrival hotel is situated in a great spot with Madisson Square Garden just across the road and only a short walk to Times Square. Despite many other reviews i have seen the check in was not very busy we were quickly handed our card and set off to the room. My partner and I were only in the City for 1 night to do a quick bit of shopping so the fact that the hotel started to look a bit old fashioned and in need of a good clean and makeover didn't worry us too much. When we got to our allocated room on the third floor we eventually found the room (it's rather hard to find doors as the numbering on some floors seems somewhat unusual to say the least). I opened the door and the room was very small the carpet was dirty the bathroom was disgusting a tap that dripped constantly stains all around the bath paint peeling off everywhere. The aircon didn't work in the room either the view out the window was of a concrete wall. The last straw was when i looked at the alleged double bed! I've slept in bigger single beds! I went down to the front desk and told tem i was not happy and was not prepared to stay in the room. With no further questions i was moved to a kingsize room! This to was fairly disgusting stains everywhere again but no dripping tap and it was a front facing room so we looked straight down on the Madisson Garden complex this really made up for the problems. Like all New York hotels it was very noisy and we had to keep the window open as again the aircon unit was useless. The hot water took about 10 minutes to get hot and the remote control on the tv didn't work nor did the internet connections. I would not stay there again if i'd have not been given the second room i would have made friends with the local homeless folks! Also reception staff upon checking out where not the most helpful or polite people it may be an idea to have more than 2 members of staff on duty for a hotel that alleges to have 1700 rooms!,A TripAdvisor Member
UR3709083,2005-28-July,I have been staying at Hotel Pennsylvania with my girlfriend for a couple of days. It has been a disaster and the hotel should be called Transylvania instead. We had to stand in line for at least 45 minutes until an arrogant Chinese front desk guy with a very bad attitude checked us in. I asked for a renovated room and even offered to pay for an upgrade. He told us that all the rooms were the same and gave us the keys. Sure the lobby and the ultra modern elevators with little TVs showing CNN are kind of neat. But the floor with pealing wallpapers and dirty carpets did not promise very much. The room then was a disaster. The bathroom's ceiling was moldy and dirty. It seemed like the carpets have never been cleaned during the last 20 years. And the worst thing: We have been asking and reserving a room for two. That tiny stinky hole only had one very little bed (not even queen size) in it. So I picked up the phone and asked how all of this was possible. After holding for about 20 minutes I was told to come down to the lobby to the concierge and get a new key for a room in the 5th floor (they gave me a room number). My girlfriend waited in front of that room with our luggage (of course they did not offer us any help with our bags) while I talked to the concierge who did not know anything about a new room. I was get into the check-in-line again. Finally I got another room in the 10th floor. So I had to pick up my girlfriend again in floor number 5. Our final room was not great either. The carpets and wallpapers have been very old but at least we got two beds. There was no window curtain to darken the room but after calling again and waiting for about an hour two guys brought one. It was the worst hotel I have ever experienced (and I have been to the YMCA). And the service was not good at all. If you check your luggage you have to pay six dollars per bag! And one day we saw a newly modernized room while the door was open. So really not all the rooms are alike like the front desk guy told me. I would not give a single star to this type of place. I would never ever stay there again. It made the whole trip a bit worse. Don't stay here!,Ocrame
UR3236247,2005-28-February,First of all to be fair I will say that we stayed here a couple of years ago and possibly things have changed for the better. Our room was tiny - no bedspreads or headboards on the beds. Worst of all was that our beds were against a wall that contained the bank of elevators. All night long we heard the elevators going up and down. We would have left immediately but the price and location were good and we didn't feel like searching around for another hotel with 2 children in tow.,A TripAdvisor Member
UR4307340,2005-28-December,I booked this on the internet based on the lovely photos and location. The location cannot be faulted central to everything you want on a trip to Manhattan. The lobby is beautiful and sumptious on arrival. Check in service was quick and polite. However when we stepped out of the lift on our floor I thought we had entered an episode of Kojak. The corridors were filthy and looked like something that had remained uncleaned for years. There was what looked like blood spattered all over the door to our room. All the doors along our corridor looked as though they had resisted attempts to kick them in. The furniture in our room was pleasant and in good condition. The linen and carpets were clean as was the bathroom but the room like the corridors looked like it had not been decorated or painted since the hotel was built. Overall we were dissapointed that the hotel photos on the net are obviously very selective and do not give a very honest impression. We enjoyed our stay but had we known in advance of the state of the rooms I would have booked elsewhere.,picklefactory
UR4147002,2005-27-November,I only wish I had read the reviews on this Hotel before I booked. The first room they gave us was a nightmare paint peeling from the walls water stains on the ceiling handles on the dresser were broken off. My wife went down to the lobby to request another room which they gave us and was somewhat better with only the paint peeling from the ceiling and the shower fixture was barely hanging on. If I could have gotten out of staying here I definately would have.,A TripAdvisor Member
UR3614846,2005-27-June,AS other peple wrote on this site I couldnt keep my mouth shut. I had to tell evrybody who plans to go to NYc NOt go to this flthy hotel. I was shocked the moemnt I checked in. The service and the arrogance of the receptionist really shocked me. Is this supposed to be the Hospitality industry? When I got to my room floor..OMG the place looked like hell. The carpets all stinky and stained. Cigar butts all over the floor.... When I opened my room and went to the bathroom I was scare to use it. There was a coucarouch on top no my familys toothbrushes!!! yuckkkk... Ill post the picture soon... IM not lying!.... We tried to speak to sombody but they wouldnt care. NYc was full we couldnt find any other place to stay. There were paapers and rubish under the beds and one day our room wasnt claened at all... not even the beds were made....... I wasnt expectiong a luxurious room... but how about hygene? Is there a place where i can send my commentaries about this hotel? I mean government wise or something... hospitaly industry?? It is totally inadequate that this hotel can be open to public in this conditions.,A TripAdvisor Member
