review_id,date,content,author
UR124292451,2012-8-February,On arrival after a long journey from Paris we went to check in in we noticed unattended luggage in and around the reception area and security not bothering to do anything about it when we got to the room on the fourth floor we found it to be already occupied by someone else we went back to reception and they rectified it by giving us another room on the fifth floor where there were lots of noisy foreign teenagers rampaging around. In the second room the toilet was blocked full to the top we had to move a third time before settling for the night. The room was grubby and dirty the bathroom was tiny the shower didn't function correctly - all in all the whole place is a dump and I definitely wouldn't reccomend going there. We made a fuss and were given a refund in the morning befor we left.,carl s
UR124189091,2012-6-February,Stayed here for one night with my wife and 3 year old daughter for our first trip to london after a long day sight seeing we checked in . As soon as we stepped through the door i was dissapointed. and it imidiatley put the dampener on our weekend We paid 89 pound for what was supposed to be a triple room what a rip off !  i have stayed in bigger single rooms. The room was so small we couldnt fit our push chair in it the three single beds were uncomfortable with just a plain white sheet and no bedside table the floor looked dirty the bathroom was in need of replacement and had black mould everywhere you looked the bedroom had bits of wet toilet paper stuck to the walls and ceeling and crayon marks all over the walls the curtains were half a foot shorter than the window.to add to this there were a group of rowdy yobs on our floor shouting and swearing and being verry aggressive in the corridor at regular intervals between 12 am and 5 am. this woke my daughter up 3 times and made us feel unsafe. This should not happen in any hotel and they should provide security to deal with them. iI have stopped in travelodges in other cities before and you usually get a good standard so why does london have to be so poor if i had paid 10 pound for the room i would still be dissapointed.,60danielb
UR124114522,2012-4-February,Book this hotel on a super saver for 19. Don't get me wrong I am realistic and don't expect much for this price but I expect much better than what it was. Checked into the room at 1 after paying a 10.00 charge (which i didn't mind) to find the filthiest room ever!! There was wallpaper hanging off the walls ceilings were black bathroom was revolting there was mould in the shape of soap on the unit. No iron.... The worst was it was so filthy I developed a rash on my body. I went to reception to complain and the girl said "oh well what do you expect" NOT HAPPY!!!,KaiEvs
UR123914320,2012-31-January,I would recommend Travelodge in general having stayed in and been perfectly happy with many of their hotels in the past. However this particular Travelodge is pretty disgusting. The corridors absolutely stink of a mix between wet dog and cabbage. The whole place is completely battered unclean and stinking to the high heavens. The breakfast was dire and one of the cleaning staff let themselves into my room at 10am when my partner and I were still in bed. Poor show Travelodge - absolutely pitiful hotel!,FayesieDaisy
UR123877138,2012-30-January,Stayed here with my friend in January and the room was absolutley terrible! There were peoples nail clippings on the floor and hairs all over the walls! The duvet was so thin we didnt even think there was one there until i pulled it back!! And the tv wire was all cut open...dangerous!! The mugs were filthy! covered in coffee stains! wouldnt want my worst enemy to stay here!!!!,angeleyesjo
UR123747379,2012-28-January,My god where do i start...worst hotel i have ever encoutered but seeing as previous reviews have not been replied to i doubt they care about their customers but i will write this review to save others the heartache of staying here. Got tickets as a present to go to london for 3 days so booked here as if seemed central. Paid 300 for the 3 nights. Hotel is in a very rough and ran down part of London. Room was tiny and tired lookin..no shower gel or shampoo which you would expect even in a b&b. Decided to eat here the 1st night...i had goujons for starters which were burnt black and served on a tiny side plate..then had fish which was frozen and watery..told the manager it was horrible but didnt even get a complimentary tea/coffee..on departure was not even asked was our stay ok..could write more but just havnt the time..discgrace of a hotel in this modern age.,28happycamper
UR125274200,2012-27-February,Hotel is an acquisition without any clear brand or identity. My room contained dirt shadows where once furniture light fittings shelves and the missing trouser press existed in the past as well as mildew/fungus in the bathroom. So this would suggest that the room has little attention. This hotel is a shambles and speaks of a job 1/5 done. I would not stay here again. Much improvement required across the whole hotel. Paid 120 GBP for a double room this was not good value for me. Try elsewhere would be my advice unless pay a lot less..,Trade2012
UR125236001,2012-26-February,To be fair we were looking for a budget place when we booked this "hotel" however we weren't expecting such a shabby mess. The reception area is like a cross between the police precedent in Robocop and the cantina in Star Wars its loud constantly busy and if you have a problem with your room you had better expect a long wait. The room was basic which is what we expected. We didn't expect the 'matter' flicked up the walls the soft lumpy bed the dirty soiled smelly bathroom and the unclean window. The only plus was that the room was quiet even though we were on a thoroughfare. However in the morning from about seven we had to put up with constant noise from the hall as the very long cheque for breakfast passed our room. All in all a god awful place that doesn't even fit the remit "cheap and cheerful" with a million budget hotels in London we made a bad choice with this one. One to avoid at all cost.,Neilkent100
UR123499757,2012-23-January,One of the cheaper options in central London it shows all the signs of a high volume quick turnaround low maintenance establishment. The staff were pleasant enough but service is minimal. Checking in at 12:00 required an extra payment of 10 although the rooms were clearly available and ready.(The option of dropping off our bags in the luggage room also cost 10!) The rooms were well-worn and the whole place could do with a make-over. We only booked a week ahead so a double room was 70 for one night. Although it is on the Kings Cross Road its a good 10 mins walk from the station.,njord
UR126427850,2012-21-March,Travelled with a group of adult students and everybody was disgusted with this place: Screaming and shouting younger students in the hallways - no sound-insulation what so ever so anyone passing your door will sound like they are actually in your room. Security randomly knocking on doors at 1 a.m. trying to find the rascals. Half an hour breakfast-slots operated by the principle that the ones who check in first get to choose time-slot first resulting in us having breakfast at a time totally not suited for us. Breakfast variety was fine though. The beds are worn and have bad springs are uncomfortable and some are really noisy. The paint is peeling off the walls and the plumbing is bad - it takes forever to get the shampoo out and when someone's showering in another room the pipes are moaning. Our room was OK after cleaning however there were body hairs on the bathroom floor behind the door when we first arrived and they never moved... One day there weren't towels after cleaning the other day there weren't toilet paper. No phones in the room so one must go down to reception to organize these things. Altogether: Too much hassle compared to the price we paid.,FlyinBee
UR122426772,2012-2-January,stayed here as it was one of the only places that had availibility on NYE. However wouldnt stay again rooms are tired looking and smells a bit musty.the staff were sweet but ive had a lot better from other travelodges...,Dan S
UR124026651,2012-2-February,I stayed here on a two night trip in January 2012 and was grateful to come back home! The cleanliness wasnt very high with hair still in the bath tub and a pubic hair in the sink. The building obviously has very old plumbing as the pipes made very strange noises throughout the night with the walls being very thin this became very tiresome at 4am in the morning. It seems that this particular hotel is also very popular with school trips with many hyper studnts running the corridors late at night with a rather relaxed and unprofessional security guard that at one time could be heard telling people to shut the [--] up. Breakfast was a poor show too with sausage reconstitued scrambled egg tomato bacon and beans looking as though they had been out for several hours. Not very appetising at all. despite this poor reveiw i will still be using travel lodges in the future just not this one! I would avoid this hotel at all costs if possible despite the low costs i would recommend spending slightly more to get better quality.,amy f
UR124711441,2012-17-February,Dirty dark and old. Needs a facelift and double glazed windows! Kept awake most of night due to traffic. Good location though- just 5 minutes walk to station.,Becky19845
UR123129396,2012-15-January,A bit grubby and tired looking on the outside do they ever get the windows cleaned interior has seen better days chipped furniture light fittings missing parts no bathroom fan(this is a mandatory requiremenr for bathrooms without a window) just the hole where it once may have been. Missing sink plug and a dodgy mixer tap that was either very hot or very cold. The TV worked but who knows what the programmes were. Evidence that once upon a time air conditioning existed now just an electric storage heater. Surprisingly good towels clean and fairly comfortable bed. Howeverfood at breakfasr was adequate but the evening meal I had was poor quality frozen fish peas and chips did not eat there again. This could be a showcase hotel if it was brought up to modern expectations but it did what it said on the tin cheap but not so cheerful  wont recommend or return to any Travelodge again they do not live up to their publicity.,PugwashEdinburgh
UR124573396,2012-14-February,We only needed a room for one night and that was enough! The room was very basic. It was clean but the grouting in the bathroom needed some attention. The bathroom was tiny and the shower head had a life of it's own spraying the whole of the bathroom!! We paid for breakfast which was warm. I wouldn't recommend this Travelodge.,Linda D
UR125981301,2012-12-March,Second nd thrd nights locked out of room and had to return to reception to get card reset. fourth night got into room to find glasses had been taken away and not replaced so had to return to reception to get fresh glasses. No extractor in toilet a/c broken exposing wiring. TV rwemote didn't work properly subtitles on and couldn't switch off no digital chanels poor reception. Cooked breakfast poorest I've ever had sausages some white scrambled crap that might have been eggs tomatoes and beans. Last day no spoons for cereal I asked for spoons waitress went and returned with teaspoons. Asked for full size spoons after anbout 5 minutes she returned with 1 spoon. Asked for another (with partner) after a couple of minutes I noticed partner was eating her fruit stuff so abandoned hope of getting another spoon - she was using a fork. Reception area dirty kettle in room made a nise like it had an electrical fault but hitting the plug hard seemed to fix it. Room was clean and bed made every day Just noticed someone reviewing this hotel having got rooms in a 19 sale. that would be a fair price,kiltedladdie
UR124476784,2012-12-February,full of students running around in the corridors all night so that no one could sleep & no phones in the room to call reception. took 15 mins to pull our cases there from the train station. i went to the room i was given and as i opened the door a naked man dived onto the bed and shouted i screamed someone disappeared behind the door. i went back to reception to ask for a different room as there were already naked people it that one. got a slightly better room on the first floor but we could ony get to it by stairs so more lugging of suitcases. bar area very much a cafeteria but pizza was ok.,hooleyholmezonhols
UR125946703,2012-11-March,Stayed here one night for a conference nearby and I'm glad it wasn't my money that was wasted. A work colleague tried to book our rooms on the Travelodge website and the best rate on offer was 125 three weeks in advance of our stay. We ended up getting an 85 rate on Travel Republic. The only good thing about this place is the friendliness of the staff. Without exception they were among the most cheerful I've ever met - including the two massive 'bouncers' who patrolled the reception area morning noon and night. Why they have to be there on constant guard is another matter. I suspect it's something to do with the hotel's frightful location. Breakfast was good too but that's where the positives come to an end. The most important factor - the bedroom - was horrible. Peeling wallpaper graffiti lights not working no shampoo etc. There's no way this place was worth the 85 my company paid for it. It's barely worth the 19 some people manage to get rooms for by booking months in advance. But perhaps the most telling thing about this property was the fact that it was swarming with secondary school students who clearly couldn't care less what their surroundings were like. I suspect they're the mainstay of this hotel on a regular basis. I also suspect they're the hotel's principal source of unsung graffiti artists. Which in its own way summarises how this particular Travelodge is more hostel than hotel. It's just a pity it wouldn't do the honourable thing and stick to hostel prices.,LondonKairos
UR123988231,2012-1-February,I booked a weekend away in London for my wifes 30th birthday. I booked our break as a package so was limited to a couple of hotels. When a Travelodge came up as one of the options I was quite pleased as you tend to think of Travelodges Premier Inns etc to be basic but modern and clean. How wrong could I have been!Everything that we saw from the moment we arrived just looked old and tired and uncared for. I hear this used to be owned by another company but that is inexcusable. How a huge company can rent out accomodation in this state is unacceptable. It should be shut down for a total refurb.As we walked through the hotel we could see tired decor and paintwork chip off of door casings and dirty windows. First impressions of our room (room 677) werent bad but when we took a closer look were disgusted. There was plaster and wallpaper peeling from the walls and the walls and ceiling had been sloppily painted with paint on door casings and plug sockets. Upon complaining I was offered a look at another room by the receptionist who said I would 'like the other room better'. Is that an admission of how bad the rooms are? Needless to say we got a full refund and checked out immediately. We will never use Travelodge again.,Sean H
UR119105696,2011-9-October,I stayed at this hotel and paid almost 200 for a room as London seemed to be booked up (X factor was in town) The room was small grimy and no frills even though it once looked like there should have been a hairdryer and remote control as there was a place name for both items. I stay in hotels for business all the time and all over the world and I have some pretty horrific experiences but I would say this place makes it into my all time top 1 worse hotel. Congratulations Travelodge no speeches required and please no repeat performance.,Andrew M
UR120368252,2011-9-November,To place this review into context I do not usually stay in such hotels though last year had very pleasurable experiences at the Premiers Inns at both Heathrow and Gatwick. This stay was booked by a charity for whom I was doing some work. I will try and remain objective and recognise the cost/value element but there is absolutely nothing good that I can say about this dirty scruffy "hotel". Paint on corridors and doors and in the lifts was scratched and marked throughout and the box room I was given had not seen any paint for a number of years. The only thing good about it was that it was quiet - though I suspect rooms at the front would be different. This was the first ever stay in a hotel where no soap was provided. The bathroom floor was dirty and covered with hais the bedroom carpet had not been hoovered for a long time. I tried to use the free wifi in the bar but gave up afte an hour - no problem logging on but slower than the slowest snail. I decided to have an early breakfast in the hope it would go smoothly- forget it. When I arrived at 07.20 most of the tables had been used and had debris of one sort or another on them - a waitress did later attempt to clear some - why the management do not realise that if they had given her a small trolley it would be so much more efficient and could have carried cleaning materials of which she had none - thus she cleared (some of ) the tales but did ot clean them. The juice machine dispensed cold water the supervisor shrugged her shoulders when told the toaster was on a go slow - you had to put your toast through six times to get it cooked - obviously an energy saving attempt. The scrambled eggs were inedible the bacon beans and sausages were cold though the sausages were tasty and the coffee - I am not even sure it was coffee...... Enough said - don't go near the place and I certainly will never visit another Travelodge.,allan09
UR107465446,2011-9-May,soiled towels toilet seat fell off toilet uncleaned was left pebble dashed. no plug in sink no soap or tumblers in bathroom.as hot as a sauna with heating turned off. no opening window .could not get another room as hotel was full at 11pm finally provided a fan off reception desk.no remote control for t v .20 minutes wait for drinks at bar . food at dinner took 50 minutes for starters to appear then another 20 minutes for mains followed by an inedible sweet. breakfast was a farce no cups after 10mins wait paper cups came servittes were blue cleaning paper from a roll on bar gave up with cooked breakfast as by the time bacon arrived 10 minutes after asking they ran out of sausage and beans bread was frozen .take our advice and stay well clear,yorkie041
UR92318067,2011-9-January,This has to be the WORST hotel i have stayed in we booked this as it was close to the Eurostar as we had an early departure. We booked a double room on arrival we checked in was give a room took ages to get to lifts terrible!! entering room looked on then we realised it wasnt even a double it was twin pushed together with wheels on!!!! there was rusty nails sticking out the skirting board the tv didnt work no batteries in the remote the towels and sheets looked grubby. Bathroom was Just as bad!!! It was throughly disappointing terrible start to our holiday and a complete let down by the Travelodge Chain. It was very noisy through the night and i think alot of the rooms where being used for some sort of business without being too rude!! Will NEVER Return.,sassylady24
UR116431145,2011-8-August,As I walked into the reception area my first impression was that this hotel needs a total refurbishment which was confirmed when I saw the room it was very basic (which was expected) but didn't expect it to be so shabby. For the 3 nights we stayed. the rooms were never cleaned once the only positive thing I can say is that the bed was made daily!! We had no hot water for 2 days as the boiler had broken. and the staff were rude and unhelpful. The breakfast was also disappointing we had to wait for more food to be brought out and then some of it was cold rather than hot. Didn't enjoy my stay and would never return!,UnhappyHullengland
UR119048518,2011-7-October,I stayed at this hotel for 1 night on a business trip. I booked 5 days in advance and was unable to take advantage of any reduction in room rate so paid 130. On arrival the service was fine and check-in was quick and easy. The room was small but I expected that to be the case on booking. The room was in dire need of repair and redecoration the walls were scuffed lamp shades broken and dusty and the bathroom had seen better days. The bed was comfy and the linen was clean the pillows were terrible ended using all 3 to provide support when sleeping. The room was very quiet and I slept very well. There was no hair drier in the room I only discovered this when I had just got out of the shower and I couldn't be bothered to go to reception and 'request' one. I paid in advance for the breakfast as I didnt know if there would be anywhere local to eat the breakfast was nice but not work the 6 there are macdonalds and other food outlets in close walking distance. The hotel location was ok only a short walk from Kings Cross it is worth noting that the Pentonville Road exit closes after a certain time in the evening so you have to walk an extra 5 mins from the main station. I was a little concerned walking to the hotel after 9pm by myself but it was ok. Overall I found the hotel over priced and in need of refurbishment.,MrsHutchy06
UR107257705,2011-7-May,Food is expensive and the bar and restaurant never opens on time and you'll probably have to wait 30mins for the staff to finish setting up before you actually get served. When you do finally get your food it will be small burnt and not all ingredients will be there!! I would not recommend you stay in this dump hole rip off joint!! Oh and don't decide what you want to soon as they have probably run out before they have even served a single person as we found out!! Staff are also rude you must have to pay for a smile these days.,Bingchick88
UR111981679,2011-7-June,Went here with my boyfriend and parents for two nights in London. The hotel is in a very good location but I would not recommend staying here. The hotel is like a very poor 70's motel. In my room there was grime on the bathroom tiles and the toilet flush was hanging off. The cistern also filtered water through into the toilet basin all night. Breakfast was terrible barely any options glasses and cutlery were sticky and unclean. Staff weren't particularly helpful when complained about this. On the second day there was no cups or glasses even available. Not worth 7 per day more like 7p....The hotel is no smoking but reeked of smoke from cigarettes. The rooms were small but fusty only 3 pillows on a double bed no phones TV was tiny and older than myself [I'm 21]. My parent's bedding had holes in it. Terrible even for a travelodge. Do not stay here it's pretty much a hostel masquerading as a hotel.,kimmisixx
UR117763405,2011-6-September,Reception and dining area look fine but once you enter your room you are transported back in time to the 1960s which i assume is when this place was last decorated.View from window was a courtyard car park with a skip which was used at 530 am every day.Room was dirtywalls covered in stains.bathroom was approx 1 metre x 1 metre.Poor effort from Travelodge!,Tammix
UR119003635,2011-6-October,Stayed over in London for work. London was pretty full due to London fashion week so ended up here. Wouldn't choose it again. the stay cost about 120 and would still have been poor value at half that. Had a meal in the restaurant. Given a filthy glass (could actually scrape the scum from off the inside) and not a word of apology when I returned it for a new one. The bedroom had obviously had a double bed removed (could tell from the headboard space) and replaced with 2 singles - except they were narrower than standard singles - looking like boarding school cots. Didn't really feel confident that anything was properly clean. Next morning all the lifts were out of order and someone from reception was coming up the stairs as we walked down telling us they'd be fixed within 2 hours!,Carokokos68
UR107154888,2011-6-May,Booked this hotel as my sister was coming over to London to visit thought it would be nice and affordable as it wasnt 1st time when i've used Travelodge! Totally shocked when i entered the room! Horendous! Dirty walls carpets very dusty furniture! Just couldnt breath properly! Complained to the reception ppl changed 3 rooms as worst!! Not very helpful and one man was quite rude saying if im not happy then i should go to another hotel pounting the pc to make another booking! Appauling!! We left next day and we didnt get a refund for the other nights we payed for!! Will not recommend!! Wast,Luzzie
UR111823395,2011-6-June,We stayed twice in a week there and back from Disneyland.The first time we were moved 3 times-room 1 plugs and electrics not workingroom 2 not cleaned and room 3 (11pm)dirty bathroom. Second time(11.30pm) leaking toiletfilling all nighttiles coming off in bathroomno power to the A/Ccouldn't open windowsno spare pillows availablebulb missing in bedside lightdoor wouldn't lock and curtains hanging off the rails. Met a couple from Sweeden and assured them that not all British hotels are this bad and they've been really unlucky.,ShrewsburyChefette
