review_id,date,content,author
UR119768863,2011-26-October,We stayed here on 22nd Oct family of 4. Location was perfect and we found it easy to find. Room really needs painting and wasn't clean. Bed was horrible and hubby ended up sleeping on the sofa and daughter with me as it was too bad for his back and really uncomfortable with 2 adults in it. Staff need customer service skills not 1 had a smile on there face and looked like they hated there job. Breakfast was cold and not organised at all. Will not be going back again.,diddldonna
UR115795581,2011-26-July,My boyfriend and I stayed at this Travelodge for 2 nights a Saturday and Sunday after trying to find somewhere that wasn't full (and cheapish) to no avail. We were told our room number and went in to find a spacious disabled room (that we didn't ask for as neither my boyfriend or I are disabled but we weren't going to moan about having a big room!) and realised that the help alarm was ringing. I went to the reception to be told that "You must've pulled the cord" however the man came in and turned it off. What is worrying is that the alarm must have been going off for a while and no one bothered about it. Although bed was very comfortable but we could hear the boilers under the floor and the air-con was noisy. As it was a street level room the windows didn't open and there was no ventilation in the bathroom. The hot tap water wasn't even luke warm and the shower took ages to heat up and wasn't very powerful (probably because the hose was leaking). As I didn't take my own hairdryer I borrowed one of the hotels; this worked for about a minute then over heated and started smoking. Luckily my friend and sister were staying in the same hotel and they'd bought a hairdryer I went up to their teeny tiny twin room to borrow theirs they said their shower was really powerful but the decor was tired and it was a bit dirty. I know that Travelodges are budget hotels but I've stayed in much better ones that this and to be honest it wasn't really all that cheap. I definitely wouldn't stay here again despite the location being close to Kings Cross station and on a quiet road.,AgentAlice
UR94523284,2011-26-January,The most basic of accomodation. Very tired. Graffitti in the internal lifts. Stained carpets walls and bedding. Rooms equipped with TV and kettle only (no phone no toiletries no hairdryer and just the one thin towel).,SRRNorthamptonshire
UR121026589,2011-25-November,Ranks with the Manchester Central as worst of the Travelodge chain ive stayed in. Initial checking in delayed as they couldnt find my booking on the system despite my having a printed copy of booking with me. Receptionist Katie was very helpful but it still took 20 minutes to rectify. Hotel public areas very busy including 2 police officers who were in the process of questioning a guest near the lifts. Lifts filthy scruffy and antiquated. Corridor to room musty smelling carpets grubby poor lighting. My room 425 classed as a Single but incorporated 3 child size single beds at a width of just 2 feet each. Strange smell in room. Lightingagainpoor. Bathroom small poor water pressure for shower. Grubby and dirty marks all over walls. Carpet slightly sticky. Decided to eat with work colleague at in-house restaurant. Reasonably priced food but poor quality.Overdone and almost burnt. Sleep pretty much impossible constant slamming doors throughout night music coming from somewhere at a deep bass lots of arguing between people in corridor for long periods of time more slamming doors etc etc etc. Work colleague experienced same problems 6 doors further down though at least my room didnt have what looked like dried excrement on carpet or blood spattered bathroom wall like hers did. Breakfast really not good tinned fruit fat soaked bacon and sausage diluted fruit juice sour tasting coffee. A pool of rank smelling water appeared on the floor apparently from the juice dispenser right next to out table halfway through breakfast. A yellow plastic hazard sign was placed over it but no attempt made to mop or clear it up. Absolutely nothing to recommend about this hotel at all.,Tommo44
UR109845825,2011-25-May,Don't be lulled into a false sense of security by the Travelodge banner this place is a dump. room tatty walls damp mould in bathroom appalling breakfast. the whole place feels like a cheap hostel with vending machines everywhere. room was barely cleaned and my bed was made under the book I'd left on it and towels left in a heap on bathroom counter. dark rooms too just very grim all in all,pinkjo
UR118522482,2011-24-September,The hotel is in a great location so i suppose that's what you pay for? However its very tired looking. the room was ok and clean just very run down! we paid 85 for the one night which isn't too bad considering the location. I wouldn't pay any more than this price though!!,71AndyR
UR119686864,2011-24-October,Travelodge used to be a brand you could trust for decent but no frills accommodation. Now it is cheap and tired. The mattress was so soggy we rolled into the middle. The window was a slit high in the wall and we could not see out of it unless we stood on tiptoe on the desk. Only 3 pillows were provided for 2 people and one small bar of soap. I have since suffered with a terrible neck and back ache due to the quality of the bed. It is near Kings Cross and so is in a reasonable location although there are plenty of closer hotels. This cost 98 for the night and was not worth it.,Spiritus26
UR105249272,2011-24-April,Stayed here for two nights. Even by budget hotel chain standards this was poor. Hotel was filthy. Customer service was minimal. Fixtures and fittings were tired and shabby. Walls are very thin. This is a large hotel and part of a multi-national chain should be able to do better.,sm71
UR119617772,2011-23-October,Positives  location inexpensive if booked on the internet in advance & coffee tea making facilities. Negatives ; tiny rooms even smaller bathrooms. No room for bags for 2 people and dreadful soft  saggy beds where it is impossible to get any rest. This seems to be indicative of most Travelodge hotels in UK but at this hotel - they "took the cake". Room also had a weird mysterious noise in the early hours ( plumbing ??? ) but it really sounded more like a ghost. Better value elsewhere.,beenaroundthailand
UR109533096,2011-23-May,Okay London is expensive. We've done the cheap hotels (think orange) and earlier this trip a mid-price. This booking was done on our behalf by a relative so we hadn't researched it ahead of time. That said I was expecting a bit more. After all it is a Travelodge. But the name doesn't mean much at Kings Cross Royal Scot. The lobby was the most modern aspect of the hotel--once you pass the check-in desk you're back in time to a shoddy past. The elevator ride is exciting because you don't know for sure that you are going to arrive on a floor. But the long narrow hallway walk to our room along the red-patterned carpet did not prepare us for our room--a stale moldy-smelling bathroom a stale smelling bedroom and a window dating from the 1970s greeted us. Okay the good news is no bed bugs. The toilet and shower worked--you just needed to look (and smell) beyond the black mold everywhere. There was a tv. The window could open 2 inches. The beds had fresh sheets. On the other hand the AC/Heat unit didn't work and looked as though it hadn't worked for years (can you say 'dust build-up'?). There was no phone in the room. Pillows were more like slivers of fabric than fluffy head supports. Beds were bouncy meaning the springs had sprung long ago. We didn't use the drawers. So cheap yes but Easy Hotel is similarly cheap--however Travelodge rooms are bigger and have a window. It was a great location for our early morning Eurostar departure--a 10 minute walk to St. Pancras station. You get what you pay for--we paid a little (for London) and at this Travelodge this was what we got.,mel1000
UR114675431,2011-23-June,Stayed for 2 nights in June 2011 and having read the reviews beforehand I was fearing the worst. Day 1 - one lift working out of three (seems to be a recurring theme here) and had to wait 20 minutes to get to the room. Day 2 - no lifts working! - had to heft my case up and down 2 flights of stairs. Restaurant had sectioned off 2/3 of tables for a large party booking leaving 6 tables for the whole of the rest of the guests. Food did not appear - had to have a refund - elderly couple in front of me were desperate as being diabetic they had administered their insulin and were becoming hypoglycaemic waiting for their food. Constant noise of doors slamming and people shouting during my second night here,james_bethel
UR97726543,2011-23-February,I stayed at this hotel for 1 night and have to say this was the worst hotel experience I have ever had. Travelodge hotels are generally cheap but good value normally. I arrived at the hotel thinking it was quite cheap for London but Travelodge's are a famous chain and must have a minimum standard??? How wrong. We arrived at the hotel and immediately it was incredibly dirty and the staff were really rude and poor. Initially they couldnt find us or any knowledge of a booking and then miracously they did find us. The rooms were very shabby skirting boards and walls all stained and dirty mould in the bathrooms paint falling off the walls No decour in the room and the window didnt shut properly. Therefore it was really noisy all night and hardly slept. Breakfast was SHOCKING! Very poor selection none of the staff knew what they were doing. Ran out of breakfast items and when asked a member of staff to re-fill was told they couldnt as they were not allowed to move from the spot because their manager would shout!!! Chairs were fithly dity rubbish and litter on the floors tables weren't cleaned. After leaving this hotel you genuinely feel you need to be fumagated!! None of the chairs in the lobby rea matched the lifts were shabby and did not feel safe in them at all. Horrendous experience... never again and would not recommend this to anyone. Not Travelodge standard at all and avoid at all costs.,avfc4life16
UR122018484,2011-23-December,Stayed for a night out with friends so wasn't in the hotel period for any length of time but that was by choice!! + Price - For London its great we paid ~60 for a room for the night Location - 5-10mins walk from Kings Cross although on the way you do pass another Travelodge which looks a lot nicer! Reception area - Is large and bar/"restaurant" well lit and looks ok. - Condition - On walking up to the hotel many areas of it are boarded up which is hardly welcoming! Surrounding area - A little rough to say the least with plenty of kebab shops and unsavoury types get a cab right to the entry would be my advice. Rooms - I stayed in the covent garden travelodge and the rooms were 2to3 times the size I felt a little cramped! Service - Have to ask someone at reception for someone at the bar to get you a drink seems to be a lot of staff not doing anything. Size - Seemed like a massive walk from the lifts to my room plus the lifts are hardly modern and swift!! Overall give this one a miss unless you get a real bargain and have your eyes open to what you are booking 1* which is barely better than a hostel.,Joey95
UR117146772,2011-23-August,We arrived at 9pm on a Saturday night after a long journey. On arrival in the room we discovered that there was an electric radiator an air conditioning unit and televison all with wires sprawling out the walls and on to the floor waiting for people to trip over them. Further inspection of the furniture revelaed splashes of paint all over following some slap dash attempt at decorating. The bathroom was truly revolting with poorly fitting cracked tiles a broken loo roll holder and other items of questionable origin. The shower did not work having no pressure and being started by pulling a rather rusty nail. When we raised these concerns with a rather surly young man on our return from dinner we were told that we should have checked the shower when we first got into the room and there was not much he could do about it now. It took a full and frank exchange of views before he agreed to move us to another room without a word of apology for the state of the room or inconvenience caused. The room we moved into was slightly but only slightly cleaner although there was a large amount of mould in the bathroom and paint and paper falling off the walls. We were also advised by another guest not to take a particular lift as the doors didn't close all the way. We were not able to get the cheap rates that some of the other contirbutors to this site seem to have done and it represented no value for money or quality of service at all. It seems it is using it's proximity to major train stations and the knowledge that many people will only stay for a short time as an excuse to shaft the travelling public. Only has a one rating as we can't give it a zero!,psmith987
UR120921189,2011-22-November,This used to be a good Travelodge but is now average and if it doesn't improve will get as worse as Farringdon. Stayed at Room 289 the same room I stayed at a few months previously. No coat hangers in the wardrobe I asked at reception but none were delivered during my 2 night stay. Toilet seat was broken shower was faulty grouting in bathroom needed cleaning sink only ran hot water no cold wallpaper bubbling on wall. If I had company I'd have to complain to be moved but was on my own so put up with it. Travelodge are definitely going down market rapidly. On plus side this Travelodge is very conveniently situated for most parts of Central London owing to its excellent transport links. Food and drink in the bar isn't bad either and reasonably priced. The Star chip shop across the road is excellent for pie and chips and donner kebabs!!,NICHOLAS042
UR109272957,2011-22-May,THREE of our room lights were not working and asked them to fix on the first night right after our checking in however we were told impolitely by the female receptionist to wait until the next morning because their maintenance people had already gone home and they could not do anything about it which was a joke for us as they cannot even find and change a light bulb!!! I have learned straight away that they do not bother to listen to their customers sincerely and take action on their complains ASAP. I asked again next morning with a reminder note and our room number on it but the lights had never been fixed during our stay (three nights) very disappointed. Toilet was dirty with a filthy stain on the wall which I cleaned by my self on the first night and I bought anti-bacterial wipes for the next two nights which was taken away from our bathroom on the second night. The location is good and the price was cheap but the next time I personally am happy to pay more for the better service than this.,JapaneseTraveller888
UR117080538,2011-22-August,Do not bother with this insurance that is offered with your booking at a cost of 1.50. This is a scam. You can only make a claim in the event of Death Serious Illness Injury Redundancy Call for jury service etc I made a booking for a room and then realised I had booked the wrong date. I cancelled the booking and re booked on the correct date. Travel Lodge debited by card and will not refund as it was a 'Saver' booking. The insurance will not pay.,NicsHols
UR105037162,2011-22-April,Haved stayed at many different Travelodges and have usually been happy with them but this particular hotel fell way below the standard expected. The room was filthy upon arrival l I found a towel which appear to covered in dry sick and tissues in the bath and the bedding had stains on it. The room facilities were poor the air conditioning did not work and there was no kettle in the room. The reception was bombarded with groups and it felt more like a low quality backpackers hostel than a hotel. There were insufficient lifts for the number of guests meaning you were frequently waiting and then when a lift arrived you could not get in because it was full. The stairs were not clearly sign posted and so at one point I thought i would never make it down to breakfast which on reflection would have been a blessing. I made the mistake of pre-booking breakfast - there was only once machine for toast and a big queue had formed next to it and there were not sufficient cups of glasses to get tea or juice. Had a bowl of cereal and made a swift exit. It really lets the Travel Lodge brand down would never stay there again.,Seadog243
UR97472006,2011-21-February,I stayed here for 2 nights either side of a trip to Paris. We picked this Travelodge thinking it would be close to Eurostar - our first mistake. The '3 mins' to St.Pancras is more like 15 especially when wheeling luggage. Inside the hotel the interior is cheap - carpet held down with duct tape chipped and tatty paint smell of 'old socks' in the corridors. Inside the room it was more of the same dirty carpet chipped walls scuffed black marks on skirting board. Marshmallowy mattress the bathroom toilet had brown limescale on it as did the sink plughole. We found the previous occupants shopping labels next to the TV which made you wonder just how thoroughly the room had been cleaned. It was noisy full of school parties and generally highly unpleasant. And the worst thing was it wasn't even cheap.,felixandmaddie
UR117045610,2011-21-August,The hotel room is terriblei have stayed in more basic hotels which were better than this.the rooms felt like a hostelthe staff made it feel like you were a burden to them and the restaurant food was poor.its amazing the difference between different travelodges.i booked this hotel thinking that they were all the same standard.how wrong i was.i have paid 29per night for a hotel room which were far better.i wont be staying at here ever again.,Tinaandant
UR100879853,2011-20-March,Just returned from a 3 night stay with my wife and 9 year old son. On arrival I was told that I had two rooms booked when I only needed/booked one and to make things worse it could only be sorted out by emailing customer services (still waiting for a reply !!!). The main problem for me was the hordes of ill-mannered ignorant inconsiderate Italian students staying in the hotel. They seemed to be everywhere in the lifts waiting for lifts loitering in reception and making noise till very late at night. One morning my family and I were having breakfast when two of the students decided to stand at our table and proceed to eat their food without so much as a 'excuse me'.......... god that pissed me off !!! I had a room booked at a Premier Inn but cancelled it to save a few quid do yourself a favour and spend a bit more on a decent hotel........don't make the same mistake I did.,tazman1963
UR114553826,2011-20-June,I stayed at this Hotel last week. On arrival I was greeted with a " it'll cost you ten pounds as it's not 3 pm yet" that was before I gave my name. On challenging this with the duty manager she told me it clearly states on booking confirmations at the time of booking. The organisation is work for uses an agent so this would never come through to me. And for the record other than an attempt to extort money from the customer what is the fee for. I then paid the 10 pounds and was checked into a sub ground level room with a window located about 8 feet from the ground covered with a half open filthy net curtain. It was room 102 and I'll bet it's still half open and still filthy. The bed linen smelled old and not professionally laundered the duvet was wafer thin as were the pillows. The walls were stained and scuffed. The bathroom was dirty too the shower cleaned to hand height the toilet seat was covered in PVC water resistant plastic that was broken down and let water into the mdf frame. Once in the bathroom close the door and there was an accumulation of dirt dust and something else behind the door. I will never stay there again or indeed in a travelodge - I can only think there is not enough competition in London so dumps like this will thrive. Britain is about to host the 2012 Olympics and god knows what foreign guests will think of our country........when I complained to reception the girl I spoke to was arrogant surly and disinterested.,David145
UR116980025,2011-20-August,Scruffy small hot room for one night. Disinterested hotel staff. Okay for one night at 42 pounds for a triple room inc breakfast however if I had not got this super price I would not have been pleased. In walking distance of Kings Cross Station.,Silapin
UR118860474,2011-2-October,I stayed here with my boyfriend for a weekend at the end of September as I took him to London as a surprise for his birthday. We were hugely disappointed with the whole establishment. The welcome we got upon arrival was luke warm with staff acting as if we were more of a nuisance than the reason they were there. Over the whole weekend we stayed in Kings Cross all three lifts were out of action bar one occasion no apology was given for the inconvenience and from past reviews this seems to be a regular occurance. On the first night my partner and I popped into the bar for a quick drink before going to our room. There were only a handful of people drinking. The bartender was no where to be seen. We were waiting over ten minutes before someone arrived to serve us and even then we were given a frosty reception. The bar tariff on the wall was outdated and we ended up paying double the prices that we were originally quoted. On the Saturday morning we left the do not disturb sign on the door as we didnt want the room made up. When we got back that evening the sign was no where to be seen our room had been made up and all our toiletries had been left just chucked in the sink. When on the sunday morning housekeeping knocked on the door as we had no do not disturb sign to put out we shouted no thankyou which completely ignored and three women came barging into the room with no further warning. All in all a most unpleasant stay. We shall not be staying with travelodge again and we will only be recommending to others to STAY AWAY!!!,slemilliere
UR100756633,2011-19-March,This was truly a hotel from hell! Mould all over the Walls drafts through the windows damp sheets which my 10 year old couldn't sleep in so had to sleep fully dressed gangs of teenagers roaming the corridors trying to get into our rooms police called in at 1:30 am to keep watch on floor 5 which had little effect drawers hanging off units pitch black corridors vomit in the sink when you arrive in your room...........I could go on! Environmental health need contacting and this "hotel" needs shutting down!!! I have never experienced anything like it!! Do not under any circumstances stay here.,Roommover
UR120763692,2011-18-November,this hotel should be shut down i have never seen so poo in my life 6 room changes and each room was dirty smelly and mouldy !!!!!!!! ended up having to bring my small children out of the hotel because of the safety issues !!!! walking them through london to get to kings cross station late at night and travelling 2 hours home !!!,Michelle F
UR100670115,2011-18-March,The rooms are damp dirty and stink. Gangs of teenagers roam the corridors banging on doors and scaring my daughter and I to death. We are there now. The hotel say they cannot move us. There is vomit in the sink and water running down the Walls next to the bed. My friend is on second floor which is better. Fifth floor is hell.,Dotsmell
UR115475261,2011-18-July,We stayed there for 5 nights and it didn't get any better we just got used to it. It was no more than a backpackers hostel. Rooms were tired shabby and grubby. Stains on carpet light fittings falling off wall paper ripped (you get the gist). I have now read reviews and someone mentions about not expecting aircon for such a meagre price - I have to disagree when you can't open the windows because of the noise outside then I think aircon should be a must. Breakfast was like a cattle market most mornings although there appears to be a separate room for 'groups' this did not stop the 'groups' coming down to the main dining area making it very busy. The cleanliness of the bowls/area left alot to be desired. One morning staff were wrapping cutlery in the 'paper towels' used to dry your hands in the toilet ! Unfortunately we had been booked in there for the whole week but really it was one of those places where you really only want to stay one night and only if you really have to. We had another booking in there for later in the year which as we type is currently being changed as we will not return.,KAA905
UR121866913,2011-18-December,We stay from 13-14 dec. the false alarm was alert during 3 AM. Everybody have to evacuate during the night. Also staff are terrible ESP the curly hair guy and black guy. they never explain for breakfast voucher which is written WiFI. They never have a service mind. I will never stay here again!,Anonymous879
UR108594396,2011-17-May,We couldn't get served at the bar at 11.50pm on a Saturday night. Also the bedroom walls were filthy and stained and the ground floor area stank. Do you yourselves a favour - avoid.,TedSalad56
